666,Mythical Games,1.25,2021-11-04 00:00:00,United States,Sherman Oaks,Internet software & services,"Javelin Venture Partners, Struck Capital, Alumni Ventures Group",2018,260000000,31,1,11,4,2021,3
667,Incode Technologies,1.25,2021-12-07 00:00:00,United States,San Francisco,Cybersecurity,"Dila Capital, Framework Ventures, 3L",2015,255000000,12,1,12,7,2021,6
668,Tackle.io,1.25,2021-12-21 00:00:00,United States,Boise,Internet software & services,"Andreessen Horowitz, Bessemer Venture Partners, Coatue Management",2016,155900000,4,1,12,21,2021,5
669,Flipdish,1.25,2022-01-13 00:00:00,Ireland,Dublin,Internet software & services,"Tencent Holdings, Tiger Global Management, Global Founders Capital",2015,156340000,6,1,1,13,2022,7
670,Route,1.25,2022-01-21 00:00:00,United States,Lehi,"Supply chain, logistics, & delivery","Madrona Venture Group, Banner Ventures, FJ Labs",2018,247000000,11,1,1,21,2022,4
671,CaptivateIQ,1.25,2022-01-26 00:00:00,United States,San Francisco,Fintech,"Sequoia Capital, Y Combinator, Accel",2014,159120000,8,1,1,26,2022,8
672,BrewDog,1.24,2017-04-10 00:00:00,United Kingdom,Aberdeen,Consumer & retail,"TSG Consumer Partners, Crowdcube",2007,296770000,4,1,4,10,2017,10
673,Enflame,1.24,2021-01-05 00:00:00,China,Shanghai,Hardware,"Tencent Holdings, Delta Capital, Redpoint Ventures China",2018,470520000,18,1,1,5,2021,3
674,EQRx,1.23,2021-01-11 00:00:00,United States,Cambridge,Health,"Nextech Invest, Casdin Capital, Google Ventures",2020,700000000,8,1,1,11,2021,1
675,Nexii,1.23,2021-09-08 00:00:00,Canada,Vancouver,Other,"Trane Technologies, Honeywell",2020,101970000,4,2,9,8,2021,1
677,Spiber,1.22,2021-09-08 00:00:00,Japan,Tsuruoka,Other,"Cool Japan Fund, JAFCO, The Carlyle Group",2007,911620000,22,2,9,8,2021,14
678,Insider,1.22,2022-02-28 00:00:00,Turkey,Istanbul,Internet software & services,"Wamda Capital, Endeavor, Riverwood Capital",2012,166200000,9,3,2,28,2022,10
679,Yiguo,1.2,2016-11-09 00:00:00,China,Shanghai,"Supply chain, logistics, & delivery","Alibaba Group, KKR, Goldman Sachs",2005,800000000,12,1,11,9,2016,11
681,Glossier,1.2,2019-03-19 00:00:00,United States,New York,Consumer & retail,"Forerunner Ventures, Institutional Venture Partners, Thrive Capital",2014,267400000,16,3,3,19,2019,5
682,Workhuman,1.2,2020-06-23 00:00:00,Ireland,Dublin,Internet software & services,ICG,1999,11300000,3,3,6,23,2020,21
683,Qumulo,1.2,2020-07-16 00:00:00,United States,Seattle,Data management & analytics,"Madrona Venture Group, Kleiner Perkins Caufield & Byers, Highland Capital Partners",2012,345500000,12,5,7,16,2020,8
684,Tealium,1.2,2021-02-03 00:00:00,United States,San Diego,Internet software & services,"Georgian Partners, Silver Lake, Presidio Ventures",2008,263900000,15,8,2,3,2021,13
685,Public,1.2,2021-02-17 00:00:00,United States,New York,Fintech,"Accel, Greycroft, Advancit Capital",2008,263900000,15,8,2,17,2021,13
686,Axonius,1.2,2021-03-01 00:00:00,United States,New York,Cybersecurity,"Vertex Ventures Israel, Bessemer Venture Partners, Emerge",2017,195000000,14,1,3,1,2021,4
687,Savage X Fenty,1.2,2021-03-16 00:00:00,United States,El Segundo,E-commerce & direct-to-consumer,"Speedinvest, Valar Ventures, Uniqa Ventures",2018,310000000,9,1,3,16,2021,3
688,Pipa Coding,1.2,2021-03-25 00:00:00,China,Beijing,Edtech,"Source Code Capital, XVC Venture Capital, Hillhouse Capital Management",2017,267730000,11,2,3,25,2021,4
690,Aibee,1.2,2021-04-13 00:00:00,China,Beijing,Artificial Intelligence,"Sequoia Capital China, Lenovo Capital and Incubator, Group GSR Ventures",2017,175310000,22,3,4,13,2021,4
691,Cava Group,1.3,2021-04-27 00:00:00,United States,Washington,Other,"SWaN & Legend Ventures, Revolution Growth, Invus Group",2010,678350000,8,3,4,27,2021,11
692,Vectra Networks,1.2,2021-04-29 00:00:00,United States,San Jose,Artificial Intelligence,"IA Ventures, Khosla Ventures, AME Cloud Ventures",2011,352480000,15,4,4,29,2021,10
693,Ada Support,1.2,2021-05-07 00:00:00,Canada,Toronto,Artificial Intelligence,"Version One Ventures, Bessemer Venture Partners, FirstMark Capital",2016,190730000,11,1,5,7,2021,5
694,Inari,1.2,2021-05-12 00:00:00,United States,Cambridge,Other,"Flagship Pioneering, Alexandria Venture Investments, Investment Corporation of Dubai",2016,397000000,10,2,5,12,2021,5
695,Alation,1.2,2021-06-03 00:00:00,United States,Redwood City,Internet software & services,"Costanoa Ventures, Data Collective, Salesforce Ventures",2012,192000000,16,4,6,3,2021,9
696,Forto,1.2,2021-06-21 00:00:00,Germany,Berlin,"Supply chain, logistics, & delivery","Cherry Ventures, Northzone Ventures, Global Founders Capital",2016,615830000,20,3,6,21,2021,5
697,SmartMore,1.2,2021-06-24 00:00:00,China,Shenzhen,Artificial Intelligence,"IDG Capital, ZhenFund, Sequoia Capital China",2019,300000000,10,1,6,24,2021,2
698,Rohlik,1.2,2021-07-01 00:00:00,Czech Republic,Prague,"Supply chain, logistics, & delivery","Partech Partners, Index Ventures, Quadrille Capital",2019,300000000,10,1,7,1,2021,2
699,Prime Medicine,1.2,2021-07-13 00:00:00,United States,Cambridge,Health,"Newpath Partners, Google Ventures, F-Prime Capital",2019,315000000,11,1,7,13,2021,2
700,FloQast,1.2,2021-07-21 00:00:00,United States,Los Angeles,Fintech,"Polaris Partners, Insight Partners, Norwest Venture Partners",2013,181500000,11,3,7,21,2021,8
701,MindTickle,1.2,2021-08-03 00:00:00,United States,San Francisco,Internet software & services,"Qualcomm Ventures, Accel, Canaan Partners",2012,281300000,9,5,8,3,2021,9
702,UpGrad,1.2,2021-08-09 00:00:00,India,Mumbai,Edtech,"Qualcomm Ventures, Accel, Canaan Partners",2015,361230000,5,3,8,9,2021,6
703,DailyPay,1.2,2021-05-18 00:00:00,United States,New York,Fintech,"RPM Ventures, Inspiration Ventures, Carrick Capital Partners",2016,517500000,8,3,5,18,2021,5
704,Oda,1.2,2021-06-02 00:00:00,Norway,Oslo,E-commerce & direct-to-consumer,"Kinnevik, Softbank Group, Prosus Ventures",2013,201960000,10,6,6,2,2021,8
705,Offchain Labs,1.2,2021-08-31 00:00:00,United States,Princeton,Internet software & services,"Pantera Capital, Polychain Capital, Lightspeed Venture Partners",2018,123700000,12,1,8,31,2021,3
706,Copado,1.2,2021-09-13 00:00:00,United States,Chicago,Data management & analytics,"Insight Partners, Salesforce Ventures, Perpetual Investors",2013,276050000,10,3,9,13,2021,8
707,Gem,1.2,2021-09-28 00:00:00,United States,San Francisco,Internet software & services,"Accel, Greylock Partners, Meritech Capital Partners",2017,146000000,5,1,9,28,2021,4
708,CarDekho,1.2,2021-10-13 00:00:00,India,Jaipur,E-commerce & direct-to-consumer,"Sequoia Capital India, Hillhouse Capital Management, Sunley House Capital Management",2008,536100000,22,6,10,13,2021,13
709,MyGlamm,1.2,2021-11-10 00:00:00,India,Mumbai,E-commerce & direct-to-consumer,"L'Occitane, Trifecta Capital, Bessemer Venture Partners",2015,283880000,18,6,11,10,2021,6
710,AgentSync,1.2,2021-12-07 00:00:00,United States,Denver,Fintech,"Craft Ventures, Caffeinated Capital, Operator Collective",2018,111100000,12,3,12,7,2021,3
711,Pristyn Care,1.4,2021-12-07 00:00:00,India,Gurugram,Health,"Sequoia Capital India, Hummingbird Ventures, Epiq Capital",2018,176670000,16,2,12,7,2021,3
712,Jokr,1.2,2021-12-02 00:00:00,United States,New York,E-commerce & direct-to-consumer,"GGV Capital, Tiger Global Management, Greycroft",2021,430000000,15,1,12,2,2021,0
713,Merama,1.2,2021-12-09 00:00:00,Mexico,Mexico City,E-commerce & direct-to-consumer,"SoftBank Latin America Fund, Advent International, Balderton Capital",2020,445000000,12,3,12,9,2021,1
714,SeekOut,1.2,2022-01-12 00:00:00,United States,Bellevue,Internet software & services,"Mayfield, Madrona Venture Group, Tiger Global Management",2017,188200000,4,2,1,12,2022,5
715,BigPanda,1.2,2022-01-12 00:00:00,United States,Mountain View,Artificial Intelligence,"Advent International, Battery Ventures, Sequoia Capital Israel",2012,292500000,11,4,1,12,2022,10
716,Phantom,1.2,2022-01-31 00:00:00,United States,San Francisco,Fintech,"Paradigm, Andreessen Horowitz, Jump Capital",2021,118500000,9,1,1,31,2022,1
717,LivSpace,1.2,2022-02-08 00:00:00,India,Bengaluru,E-commerce & direct-to-consumer,"Jungle Ventures, Helion Venture Partners, INGKA Investments",2015,371690000,21,3,2,8,2022,7
718,Xpressbees,1.2,2022-02-09 00:00:00,India,Pune,"Supply chain, logistics, & delivery","Norwest Venture Partners, Investcorp, Blackstone",2012,472940000,13,3,2,9,2022,10
719,Helium Systems,1.2,2022-02-22 00:00:00,United States,San Francisco,Internet software & services,"FirstMark Capital, Tiger Global Management, FTX Venture",2013,251000000,16,3,2,22,2022,9
720,CloudBees,1.15,2021-12-09 00:00:00,United States,San Jose,Data management & analytics,"Matrix Partners, Lightspeed Venture Partners, Verizon Ventures",2010,368260000,11,5,12,9,2021,11
721,L&P Cosmetic,1.19,2016-01-01 00:00:00,South Korea,Seoul,Consumer & retail,CDIB Capital,2009,118640000,4,4,1,1,2016,7
722,Mininglamp Technology,1.19,2019-03-27 00:00:00,China,Beijing,Artificial Intelligence,"Russia-China Investment Fund, Tencent Holdings, Sequoia Capital China",2014,1003000000,19,,3,27,2019,5
723,Luoji Siwei,1.18,2017-07-20 00:00:00,China,Beijing,Edtech,"Sequoia Capital China, Qiming Venture Partners, Tencent Holdings",2012,188150000,8,2,7,20,2017,5
724,Yimidida,1.17,2019-01-14 00:00:00,China,Shanghai,"Supply chain, logistics, & delivery","Source Code Capital, Global Logistic Properties, K2VC",2015,553610000,14,2,1,14,2019,4
725,Modern Health,1.17,2021-02-11 00:00:00,United States,San Francisco,Health,"Kleiner Perkins Caufield & Byers, Afore Capital, Founders Fund",2017,168060000,16,1,2,11,2021,4
726,IRL,1.17,2021-06-15 00:00:00,United States,San Francisco,Internet software & services,"Goodwater Capital, Floodgate, Founders Fund",2017,197000000,12,2,6,15,2021,4
727,Tuhu,1.16,2018-09-15 00:00:00,China,Shanghai,Auto & transportation,"Qiming Venture Partners, Yaxia Automobile, Far East Horizon",2011,580450000,19,2,9,15,2018,7
728,SVOLT,1.16,2020-06-08 00:00:00,China,Changzhou,Auto & transportation,"IDG Capital, Bank Of China Group Investment,, SDIC CMC Investment Management",2018,3207000000,30,2,6,8,2020,2
729,LifeMiles,1.15,2015-07-13 00:00:00,Colombia,Bogota,Other,Advent International,2011,343700000,1,1,7,13,2015,4
730,Venafi,1.15,2020-12-10 00:00:00,United States,Salt Lake City,Cybersecurity,"Pelion Venture Partners, Foundation Capital, Thoma Bravo",2000,174000000,13,4,12,10,2020,20
731,Guideline,1.15,2021-06-16 00:00:00,United States,San Mateo,Fintech,"Pelion Venture Partners, Foundation Capital, Thoma Bravo",2015,339000000,14,4,6,16,2021,6
732,Rebellion Defense,1.15,2021-09-16 00:00:00,United States,Washington DC,Artificial Intelligence,"Venrock, Innovation Endeavors, Insights Partners",2019,150000000,8,1,9,16,2021,2
734,Happy Money,1.15,2022-02-08 00:00:00,United States,Tustin,Fintech,"FirstMark Capital, Anthemis, CMFG Ventures",2009,444630000,13,6,2,8,2022,13
735,Doctolib,1.14,2019-03-19 00:00:00,France,Paris,Health,"BPI France, Kerala Ventures, Accel",2013,266980000,12,3,3,19,2019,6
736,STORD,1.13,2021-09-13 00:00:00,United States,Atlanta,"Supply chain, logistics, & delivery","Dynamo VC, Susa Ventures, Founders Fund",2015,201040000,20,2,9,13,2021,6
737,TELD,1.12,2019-12-16 00:00:00,China,Qingdao,Fintech,"China Reform Fund, Gaopeng Capital, Jinhui Xingye",2014,193240000,9,1,12,16,2019,5
738,TangoMe,1.1,2014-03-20 00:00:00,United States,Mountain View,Mobile & telecommunications,"Draper Fisher Jurtson, Qualcomm Ventures, Alibaba Group",2009,373440000,15,4,3,20,2014,5
739,AppDirect,1.1,2015-10-07 00:00:00,United States,San Francisco,E-commerce & direct-to-consumer,"Mithril, iNovia Capital, Foundry Group",2009,558360000,10,5,10,7,2015,6
740,Juanpi,1.1,2016-04-14 00:00:00,China,Wuhan,E-commerce & direct-to-consumer,"Tiantu Capital, SAIF Partners China, Newsion Venture Capital",2012,136050000,7,,4,14,2016,4
741,OVH,1.1,2016-08-15 00:00:00,France,Roubaix,Other,"KKR, TowerBrook Capital Partners",1999,1243000000,10,1,8,15,2016,17
742,Eat Just,1.1,2017-11-30 00:00:00,United States,San Francisco,Consumer & retail,"Khosla Ventures, Horizons Ventures, Founders Fund",2011,706600000,34,6,11,30,2017,6
743,GetYourGuide,1.1,2019-05-16 00:00:00,Germany,Berlin,Travel,"Spark Capital, Highland Europe, Sunstone Capital",2009,884790000,22,3,5,16,2019,10
744,Ivalua,1.1,2019-05-21 00:00:00,United States,Redwood City,Fintech,"Ardian, Tiger Global Management, KKR",2000,133000000,4,1,5,21,2019,19
745,Sisense,1.1,2020-01-09 00:00:00,United States,New York,Data management & analytics,"Opus Capital, Genesis Partners, Battery Ventures",2004,278000000,10,5,1,9,2020,16
746,Pharmapacks,1.1,2020-11-12 00:00:00,United States,Islandia,E-commerce & direct-to-consumer,The Carlyle Group,2010,476000000,10,1,11,12,2020,10
747,Sennder,1.1,2021-01-14 00:00:00,Germany,Berlin,"Supply chain, logistics, & delivery","Accelm Scania Growth Capital, Lakestar",2015,310020000,14,3,1,14,2021,6
748,Nexthink,1.1,2021-02-08 00:00:00,Switzerland,Prilly,Data management & analytics,"Auriga, Galeo Ventures, Highland Europe",2004,329900000,13,2,2,8,2021,17
749,Zego,1.1,2021-03-09 00:00:00,United Kingdom,London,Fintech,"LocalGlobe, Balderton Capital, Target Global",2016,255500000,9,2,3,9,2021,5
750,Rightway,1.1,2021-03-30 00:00:00,United States,New York,Health,"Thrive Capital, Khosla Ventures, Tiger Global Management",2017,130000000,4,1,3,30,2021,4
751,Sunbit,1.1,2021-05-20 00:00:00,United States,Los Angeles,Fintech,"Zeev Ventures, Group11, Chicago Ventures",2016,197670000,8,1,5,20,2021,5
753,G2,1.1,2021-06-22 00:00:00,United States,Chicago,Internet software & services,"Pritzker Group Venture Capital, Accel, Hyde Park Venture Partners",2012,265070000,20,6,6,22,2021,9
754,Hailo,1,2021-06-23 00:00:00,Israel,Tel Aviv,Artificial Intelligence,"Glory Ventures, Maniv Mobility",2017,217000000,18,2,6,23,2021,4
755,People.ai,1.1,2021-08-11 00:00:00,United States,San Francisco,Internet software & services,"GGV Capital, Lightspeed Venture Partners, ICONIQ Capital",2017,217000000,18,2,8,11,2021,4
756,CoinDCX,1.1,2021-08-10 00:00:00,India,Maharashtra,Fintech,"Polychain Capital, Coinbase Ventures, Jump Capital",2017,109400000,17,1,8,10,2021,4
758,apna,1.1,2021-09-15 00:00:00,India,Bengaluru,Internet software & services,"Sequoia Capital India, Rocketship.vc, Lightspeed India Partners",2019,192500000,9,2,9,15,2021,2
759,Karat,1.1,2021-10-13 00:00:00,United States,Seattle,Internet software & services,"8VC, Norwest Venture Partners, Tiger Global Management",2014,151600000,8,2,10,13,2021,7
760,Enpal,1.1,2021-10-18 00:00:00,Germany,Berlin,Internet software & services,"HV Capital, Softbank Group, BlackRock",2017,750370000,19,2,10,18,2021,4
761,Acko General Insurance,1.1,2021-10-18 00:00:00,India,Bengaluru,Fintech,"Intact Ventures, Munich Re Ventures, General Atlantic",2016,428000000,22,4,10,18,2021,5
762,Daily Harvest,1.1,2021-11-16 00:00:00,United States,New York,E-commerce & direct-to-consumer,"M13, Lightspeed Venture Partners, Lone Pine Capital",2014,120980000,15,2,11,16,2021,7
763,The Bank of London,1.1,2021-11-30 00:00:00,United Kingdom,London,Fintech,"Mangrove Capital Partners,14W. ForgeLight",2018,90000000,3,1,11,30,2021,3
764,Fundbox,1.1,2021-11-30 00:00:00,United States,San Francisco,Fintech,"Khosla Ventures, General Catalyst, Blumberg Capital",2013,553500000,34,4,11,30,2021,8
765,Turing,1.1,2021-12-20 00:00:00,United States,Palo Alto,Internet software & services,"Foundation Capital, 	Frontier Ventures, AltaIR Capital",2018,136050000,91,1,12,20,2021,3
766,GlobalBees,1.1,2021-12-28 00:00:00,India,New Delhi,E-commerce & direct-to-consumer,"Chiratae Ventures, SoftBank Group, Trifecta Capital",2021,291500000,8,1,12,28,2021,0
767,LEAD School,1.1,2022-01-13 00:00:00,India,Andheri,Edtech,"WestBridge Capital, GSV Ventures, Elevar Equity",2012,166000000,6,1,1,13,2022,10
768,eSentire,1.1,2022-02-22 00:00:00,Canada,Waterloo,Cybersecurity,"Edison Partners, Georgian Partners, VentureLink",2001,287880000,12,2,2,22,2022,21
769,Beyond Identity,1.1,2022-02-22 00:00:00,United States,New York,Cybersecurity,"New Enterprise Associates, Koch Disruptive Technologies, Evolution Equity Partners",2019,205000000,7,1,2,22,2022,3
770,Nxin,1.08,2018-09-18 00:00:00,China,Beijing,Internet software & services,"Beijing Juneng Hesheng Industry Investment Fund, Beijing Shuju Xinrong Fund",2015,53050000,5,1,9,18,2018,3
771,UISEE Technology,1.08,2021-01-25 00:00:00,China,Beijing,"Supply chain, logistics, & delivery","Shenzhen Capital Group, Robert Bosch Venture Capital, SeptWolves Ventures",2016,154300000,15,1,1,25,2021,5
773,Rubicon,1.07,2017-08-25 00:00:00,United States,Atlanta,Other,"Goldman Sachs, Leonardo DiCaprio, Promecap",2008,285710000,17,7,8,25,2017,9
774,Radius Payment Solutions,1.07,2017-11-27 00:00:00,United Kingdom,Crewe,Fintech,Inflexion Private Equity,1990,200110000,1,1,11,27,2017,27
775,Rivigo,1.07,2019-07-11 00:00:00,India,Gurgaon,"Supply chain, logistics, & delivery","SAIF Partners India, Warburg Pincus, Trifecta Capital Advisors",2014,319890000,7,7,7,11,2019,5
776,Mamaearth,1.07,2021-12-28 00:00:00,India,Gurgaon,E-commerce & direct-to-consumer,"Fireside Ventures, Sequoia Capital India, Stellaris Venture Partners",2016,153300000,11,3,12,28,2021,5
777,Jiuxian,1.05,2015-07-30 00:00:00,China,Beijing,E-commerce & direct-to-consumer,"Sequoia Capital China, Rich Land Capital, Merrysunny Wealth",2009,249210000,8,3,7,30,2015,6
778,Instabase,1.05,2019-10-21 00:00:00,United States,San Francisco,Data management & analytics,"New Enterprise Associates, Greylock Partners, Andreessen Horowitz",2015,131940000,9,3,10,21,2019,4
779,Sendbird,1.05,2021-04-06 00:00:00,United States,San Mateo,Mobile & telecommunications,"FundersClub, Y Combinator, Tiger Global Management",2013,219640000,16,2,4,6,2021,8
780,Density,1.05,2021-11-10 00:00:00,United States,San Francisco,Hardware,"Founders Fund, Upfront Ventures, 	01 Advisors",2014,217200000,22,2,11,10,2021,7
781,Mixpanel,1.05,2021-11-15 00:00:00,United States,San Francisco,Internet software & services,"Bain Capital Tech Opportunities, Andreessen Horowitz, Sequoia Capital",2009,284520000,10,3,11,15,2021,12
782,Aprogen,1.04,2019-05-31 00:00:00,South Korea,Seongnam-Si,Health,"Lindeman Asia Investment, Nichi-Iko Pharmaceutical",2000,62120000,2,3,5,31,2019,19
783,OrCam Technologies,1.03,2018-02-20 00:00:00,Israel,Jerusalem,Artificial Intelligence,"Intel Capital, Aviv Venture Capital",2010,77400000,5,2,2,20,2018,8
784,Leap Motor,1.01,2018-11-20 00:00:00,China,Hangzhou,Auto & transportation,"Sequoia Capital China, Gopher Asset Management, Shanghai Electric Group",2015,1761000000,20,1,11,20,2018,3
785,Lookout,1,2013-10-10 00:00:00,United States,San Francisco,Cybersecurity,"Accel Partners, Greylock Partners, Lowercase Capital",2007,281000000,26,7,10,10,2013,6
786,Snapdeal,1,2014-05-21 00:00:00,India,New Delhi,E-commerce & direct-to-consumer,"SoftBankGroup, Blackrock, Alibaba Group",2008,1776000000,25,7,5,21,2014,6
787,TechStyle Fashion Group,1,2014-08-29 00:00:00,United States,El Segundo,E-commerce & direct-to-consumer,"Matrix Partners, Passport Capital, Rho Ventures",2010,300000000,11,5,8,29,2014,4
788,InMobi,1,2014-12-02 00:00:00,India,Bengaluru,Mobile & telecommunications,"Kleiner Perkins Caufield & Byers, Softbank Corp., Sherpalo Ventures",2007,510600000,8,4,12,2,2014,7
790,Red Ventures,1,2015-01-07 00:00:00,United States,Fort Mill,Other,"Silver Lake Partners, General Atlantic",2000,1050000000,2,1,1,7,2015,15
791,BeiBei,1,2015-01-22 00:00:00,China,Hangzhou,E-commerce & direct-to-consumer,"Banyan Capital, New Horizon Capital, IDG Capital Partners",2011,224400000,6,1,1,22,2015,4
792,Lamabang,1,2015-03-06 00:00:00,China,Shenzhen,E-commerce & direct-to-consumer,"5Y Capital, Matrix Partners China, K2VC",2011,120000000,6,1,3,6,2015,4
794,BenevolentAI,1,2015-06-02 00:00:00,United Kingdom,London,Artificial Intelligence,Woodford Investment Management,2013,345550000,7,4,6,2,2015,2
795,FXiaoKe,1,2015-07-02 00:00:00,China,Beijing,Mobile & telecommunications,"IDG Capital, Northern Light Venture Capital, DCM Ventures",2011,293000000,14,2,7,2,2015,4
796,Vox Media,1,2015-08-12 00:00:00,United States,Washington,Internet software & services,"Accel Partners, Comcast Ventures, General Atlantic",2011,324650000,9,8,8,12,2015,4
797,Mia.com,1,2015-09-08 00:00:00,China,Beijing,E-commerce & direct-to-consumer,"Sequoia Capital China, ZhenFund, K2 Ventures",2011,231600000,6,1,9,8,2015,4
798,58 Daojia,1,2015-10-12 00:00:00,China,Beijing,Internet software & services,"KKR, Alibaba Group, Ping An Insurance",2014,300000000,3,1,10,12,2015,1
799,Womai,1,2015-10-12 00:00:00,China,Beijing,E-commerce & direct-to-consumer,"SAIF Partners China, Baidu, IDG Capital",2009,320000000,5,1,10,12,2015,6
800,HuJiang,1,2015-10-29 00:00:00,China,Shanghai,Edtech,"China Minsheng Investment, Baidu, Wanxin Media",2001,223290000,3,1,10,29,2015,14
801,iTutorGroup,1,2015-11-18 00:00:00,China,Shanghai,Edtech,"QiMing Venture Partners, Temasek Holdings, Silverlink Capital",1998,315000000,10,1,11,18,2015,17
802,MindMaze,1,2016-01-28 00:00:00,Switzerland,Lausanne,Health,Hinduja Group,2012,348500000,5,3,1,28,2016,4
803,iCarbonX,1,2016-04-12 00:00:00,China,Shenzhen,Artificial Intelligence,"Tencent, Vcanbio",2015,199000000,3,1,4,12,2016,1
804,SMS Assist,1,2016-06-07 00:00:00,United States,Chicago,Internet software & services,"Goldman Sachs, Insights Venture Partners, Pritzker Group Venture Capital",2003,255000000,3,3,6,7,2016,13
806,Mobvoi,1,2017-04-06 00:00:00,China,Beijing,Consumer & retail,"Sequoia Capital China, SIG Asia Investments, ZhenFund",2012,259640000,7,1,4,6,2017,5
807,Zhuan Zhuan,1,2017-04-18 00:00:00,China,Beijing,E-commerce & direct-to-consumer,"58.com, Tencent Holdings",2015,990000000,7,1,4,18,2017,2
808,Modernizing Medicine,1,2017-05-10 00:00:00,United States,Boca Raton,Health,"Warburg Pincus, Summit Partners, Sands Capital",2010,393790000,6,4,5,10,2017,7
809,Zhaogang,1,2017-06-29 00:00:00,China,Shanghai,E-commerce & direct-to-consumer,"K2 Ventures, Matrix Partners China, IDG Capital",2012,361250000,9,2,6,29,2017,5
810,DianRong,1,2017-08-02 00:00:00,China,Shanghai,E-commerce & direct-to-consumer,"Standard Chartered, FinSight Ventures, Affirma Capital",2012,649000000,16,1,8,2,2017,5
811,Cell C,1,2017-08-07 00:00:00,South Africa,Midrand,Mobile & telecommunications,"Blue Label Telecoms, Net1 UEPS Technologies",2000,546970000,2,2,8,7,2017,17
812,YH Global,1,2017-09-21 00:00:00,China,Shenzhen,"Supply chain, logistics, & delivery","Co-Energy Finance, Grandland",1997,182050000,8,1,9,21,2017,20
813,Revolution Precrafted,1,2017-10-23 00:00:00,Philippines,Manila,Other,"K2 Global, 500 Startups",2015,15400000,2,2,10,23,2017,2
815,Maimai,1,2017-11-15 00:00:00,China,Beijing,Mobile & telecommunications,"Morningside Venture Capital, IDG Capital, DCM Ventures",2013,300000000,5,4,11,15,2017,4
816,Dxy.cn,1,2018-04-10 00:00:00,China,Hangzhou,Health,"Tencent Holdings, DCM Ventures",2000,672000000,5,1,4,10,2018,18
817,Orbbec Technology,1,2018-05-21 00:00:00,China,Shenzhen,Hardware,"R-Z Capital, Green Pine Capital Partners, SAIF Partners China",2013,200000000,8,1,5,21,2018,5
818,HMD Global,1,2018-05-21 00:00:00,Finland,Espoo,Mobile & telecommunications,Ginko Ventures,2016,330000000,6,1,5,21,2018,2
819,Huike Group,1,2018-05-24 00:00:00,China,Beijing,Edtech,"Fosun RZ Capital, Oceanwide Holdings, Shenzhen Qianhe Capital Management Co.",2010,63000000,4,1,5,24,2018,8
820,China Cloud,1,2018-06-11 00:00:00,China,Wuxi,Hardware,"V Star Capital, GF Xinde Investment Management Co., Haitong Leading Capital Management",2010,522800000,31,1,6,11,2018,8
821,LinkDoc Technology,1,2018-07-05 00:00:00,China,Beijing,Health,"China Investment Corporation, New Enterprise Associates",2014,253020000,10,1,7,5,2018,4
822,MediaMath,1,2018-07-10 00:00:00,United States,New York,Internet software & services,"Silicon Valley Bank, QED Investors, European Founders Fund",2007,613160000,14,6,7,10,2018,11
823,Movile,1,2018-07-12 00:00:00,Brazil,Sao Paulo,Mobile & telecommunications,"Innova Capital - FIP, 3G Capital Management, Prosus Ventures",1998,394000000,4,,7,12,2018,20
825,Pat McGrath Labs,1,2018-07-16 00:00:00,United States,New York,Consumer & retail,"One Luxury Group, Eurazeo",2016,82000000,2,1,7,16,2018,2
826,Wacai,1,2018-07-18 00:00:00,China,Hangzhou,Mobile & telecommunications,"Qiming Venture Partners, China Broadband Capital, CDH Investments",2009,368600000,12,2,7,18,2018,9
827,FlashEx,1,2018-08-27 00:00:00,China,Beijing,"Supply chain, logistics, & delivery","Prometheus Capital, Matrix Partners China, JD Capital Management",2014,339000000,22,1,8,27,2018,4
828,Banma Network Technologies,1,2018-09-13 00:00:00,China,Shanghai,Auto & transportation,"Yunfeng Capital, SDIC Innovation Investment Management, Shang Qi Capital",2015,696760000,5,1,9,13,2018,3
829,Tresata,1,2018-10-10 00:00:00,United States,Charlotte,Fintech,GCP Capital Partners,2011,51930000,2,1,10,10,2018,7
830,Momenta,1,2018-10-17 00:00:00,China,Beijing,Artificial Intelligence,"Sinovation Ventures, Tencent Holdings, Sequoia Capital China",2016,1283000000,28,1,10,17,2018,2
831,Hosjoy,1,2018-10-18 00:00:00,China,Nanjing,E-commerce & direct-to-consumer,"U.S.-China Green Fund, Founder H Fund, Richland Equities",2009,138530000,7,1,10,18,2018,9
832,Omio,1,2018-10-23 00:00:00,Germany,Berlin,Travel,"Lakestar, Battery Ventures, New Enterprise Associates",2013,396000000,22,3,10,23,2018,5
833,TERMINUS Technology,1,2018-10-25 00:00:00,China,Beijing,Hardware,"China Everbright Limited, IDG Capital, iFLYTEK",2015,629580000,8,4,10,25,2018,3
834,BitFury,1,2018-11-06 00:00:00,Netherlands,Amsterdam,Hardware,"Georgian Co-Investment Fund, iTech Capital, Galaxy Digital",2011,170000000,22,3,11,6,2018,7
835,iFood,1,2018-11-13 00:00:00,Brazil,Osasco,"Supply chain, logistics, & delivery","Movile, Just Eat, Naspers",2011,591860000,6,2,11,13,2018,7
