330,Vercel,2.5,2021-06-23 00:00:00,United States,San Francisco,Internet software & services,"CRV, Accel, Google Ventures",2015,313000000,16,2,6,23,2021,6
331,Sysdig,2.5,2021-04-28 00:00:00,United States,San Francisco,Cybersecurity,"Accel, Bain Capital Ventures, Insight Partners",2013,728200000,12,4,4,28,2021,8
332,Zetwerk,2.5,2021-08-20 00:00:00,India,Bengaluru,Internet software & services,"Sequoia Capital India, Kae Capital, Accel",2018,656670000,24,3,8,20,2021,3
333,Uniphore,2.5,2022-02-16 00:00:00,United States,Palo Alto,Artificial Intelligence,"Chiratae Ventures, March Capital Partners, National Grid Partners",2008,626630000,25,3,2,16,2022,14
334,Somatus,2.5,2022-02-23 00:00:00,United States,McLean,Health,"The Blue Venture Fund, Flare Capital Partners, Longitude Capital",2016,465000000,14,3,2,23,2022,6
335,Uala,2.45,2021-08-13 00:00:00,Argentina,Buenos Aires,Fintech,"Soros Fund Management, Ribbit Capital, Monashees+",2017,608000000,21,4,8,13,2021,4
336,Mobile Premier League,2.45,2021-09-15 00:00:00,India,Bengaluru,Internet software & services,"Sequoia Capital India, RTP Global, Go-Ventures",2018,377700000,30,3,9,15,2021,3
337,Cybereason,2.44,2019-08-06 00:00:00,United States,Boston,Cybersecurity,"SoftBank Group, CRV, Spark Capital",2012,713620000,8,5,8,6,2019,7
338,Cgtz,2.41,2017-02-21 00:00:00,China,Hangzhou,Fintech,"Shunwei Capital Partners, China Media Group, Guangzhou Huiyin Aofeng Equity Investment Fund",2014,535860000,4,1,2,21,2017,3
339,Star Charge,2.41,2021-05-19 00:00:00,China,Changzhou,Auto & transportation,"Shunwei Capital Partners, China Media Group, Guangzhou Huiyin Aofeng Equity Investment Fund",2014,125580000,9,1,5,19,2021,7
340,Carbon,2.4,2015-08-20 00:00:00,United States,Redwood City,Hardware,"Google Ventures, Sequoia Capital, Wakefield Group",2013,692000000,24,5,8,20,2015,2
341,PolicyBazaar,2.4,2019-05-06 00:00:00,India,Gurgaon,Fintech,"Info Edge, Softbank Capital",2008,633780000,22,7,5,6,2019,11
343,Exabeam,2.4,2021-06-01 00:00:00,United States,Foster City,Cybersecurity,"Norwest Venture Partners, Aspect Ventures, Lightspeed Venture Partners",2013,390000000,9,5,6,1,2021,8
344,BitSight Technologies,2.4,2021-09-13 00:00:00,United States,Boston,Cybersecurity,"Menlo Ventures, GGV Capital, Flybridge Capital Partners",2013,390000000,9,5,9,13,2021,8
345,Trumid,2.4,2020-07-15 00:00:00,United States,New York,Fintech,"T. Rowe Price, Dragoneer Investment Group, BlackRock",2014,711730000,22,5,7,15,2020,6
346,ABL Space Systems,2.4,2021-03-25 00:00:00,United States,El Segundo,Other,"T. Rowe Price, Lockheed Martin Ventures, Fidelity Investment",2017,483500000,9,2,3,25,2021,4
347,Project44,2.62,2021-06-01 00:00:00,United States,Chicago,"Supply chain, logistics, & delivery","Emergence Capital Partners, 8VC, Chicago Ventures",2014,928800000,20,4,6,1,2021,7
348,Bought By Many,2.35,2021-06-01 00:00:00,United Kingdom,London,Fintech,"Octopus Ventures, Munich Re Ventures, CommerzVentures",2012,477270000,8,3,6,1,2021,9
349,Jobandtalent,2.35,2021-12-01 00:00:00,Spain,Madrid,Internet software & services,"Kibo Ventures, SoftBank Group, Atomico",2009,1072000000,20,3,12,1,2021,12
350,WEMAKEPRICE,2.34,2015-09-09 00:00:00,South Korea,Seoul,E-commerce & direct-to-consumer,"IMM Investment, NXC",2009,486650000,3,4,9,9,2015,6
351,Biren Technology,2.32,2020-08-18 00:00:00,China,Shanghai,Hardware,"V FUND, IDG Capital, Green Pine Capital Partners",2019,288220000,32,3,8,18,2020,1
352,Voodoo,2.31,2020-08-17 00:00:00,France,Paris,Other,"Tencent Holdings, Goldman Sachs",2013,569950000,3,2,8,17,2020,7
353,Uptake,2.3,2015-10-27 00:00:00,United States,Chicago,Artificial Intelligence,"Revolution, New Enterprise Associates, Caterpillar",2014,317000000,8,4,10,27,2015,1
354,KeepTruckin,2.3,2019-04-23 00:00:00,United States,San Francisco,"Supply chain, logistics, & delivery","Google Ventures, Index Ventures, Scale Venture Partners",2013,417300000,8,5,4,23,2019,6
355,Skydance Media,2.3,2020-02-11 00:00:00,United States,Santa Monica,Other,"RedBird Capital Partners, CJ ENM, Tencent Holdings",2010,2075000000,4,1,2,11,2020,10
356,Greenlight,2.3,2020-09-24 00:00:00,United States,Atlanta,Fintech,"Relay Ventures, TTV Capital, Canapi Ventures",2014,556500000,22,3,9,24,2020,6
357,Bowery Farming,2.3,2021-05-25 00:00:00,United States,New York,Other,"Temasek, Google Ventures, General Catalyst",2015,630900000,31,2,5,25,2021,6
358,Odoo,2.3,2021-07-29 00:00:00,Belgium,Louvain-la-Neuve,Internet software & services,"Summit Partners, Noshaq, Sofinnova Partners",2005,319000000,6,1,7,29,2021,16
359,MoMo,2.27,2021-12-10 00:00:00,Vietnam,Ho Chi Minh City,Fintech,"Goodwater Capital, Warburg Pincus, GS Growth",2013,433700000,10,3,12,10,2021,8
360,Ankorstore,2.26,2022-01-10 00:00:00,France,Paris,E-commerce & direct-to-consumer,"Global Founders Capital, Aglae Ventures, Alven Capital",2019,420890000,9,1,1,10,2022,3
361,Zume,2.25,2018-11-01 00:00:00,United States,Mountain View,Consumer & retail,"Softbank Group, AME Cloud Ventures, SignalFire",2015,445690000,6,3,11,1,2018,3
362,Algolia,2.25,2021-07-28 00:00:00,United States,San Francisco,Internet software & services,"Accel, Alven Capital, Storm Ventures",2012,334340000,28,3,7,28,2021,9
363,Pattern,2.25,2021-10-06 00:00:00,United States,Lehi,Internet software & services,"Knox Lane, Ainge Advisory, Carlson Private Capital Partners,/td>",2013,277000000,5,1,10,6,2021,8
365,MUSINSA,2.2,2019-11-11 00:00:00,South Korea,Seoul,E-commerce & direct-to-consumer,Sequoia Capital,2001,286360000,2,2,11,11,2019,18
366,Current,2.2,2021-04-27 00:00:00,United States,New York,Fintech,"Expa, QED Investors, Foundation Capital",2015,383410000,18,3,4,27,2021,6
367,Bitso,2.2,2021-05-05 00:00:00,Mexico,Mexico City,Fintech,"Pantera Capital, QED Investors, Coinbase Ventures",2014,314660000,22,2,5,5,2021,7
368,Gympass,2.2,2019-06-12 00:00:00,United States,New York,Internet software & services,"General Atlantic, SoftBank Group, Atomico",2012,529160000,10,2,6,12,2019,7
369,Reify Health,2.2,2021-08-10 00:00:00,United States,Boston,Health,"Sierra Ventures, Battery Ventures, Asset Management Ventures",2012,257640000,8,2,8,10,2021,9
370,Dialpad,2.2,2020-10-06 00:00:00,United States,San Francisco,Internet software & services,"Andreessen Horowitz, Google Ventures, Section 32",2011,425960000,15,7,10,6,2020,9
371,G7 Networks,2.2,2022-02-15 00:00:00,China,Beijing,"Supply chain, logistics, & delivery","Eastern Bell Capital 32, SDIC CMC Investment Management, Trustbridge Partners",2006,710000000,17,1,2,15,2022,16
372,BloomReach,2.2,2022-02-23 00:00:00,United States,Mountain View,Artificial Intelligence,"Bain Capital Ventures, Sixth Street Growth, Lightspeed Venture Partners",2009,422000000,8,6,2,23,2022,13
373,Huaqin Telecom Technology,2.19,2019-10-08 00:00:00,China,Shanghai,Mobile & telecommunications,"Zhangjiang Haocheng Venture Capital, Walden International, Intel Capital",2005,276350000,16,1,10,8,2019,14
374,Accelerant,2.19,2022-01-12 00:00:00,United Kingdom,Colchester,Other,"Deer Park Road, Altamont Capital Partners, Eldridge",2018,190000000,5,1,1,12,2022,4
375,Hesai Tech,2.18,2020-08-01 00:00:00,China,Shanghai,Artificial Intelligence,"Lightspeed China Partners, Baidu Ventures, Qiming Venture Partners",2013,717290000,20,3,8,1,2020,7
376,YITU Technology,2.17,2018-03-08 00:00:00,China,Shanghai,Artificial Intelligence,"Sequoia Capital China, Banyan Capital",2012,385120000,11,1,3,8,2018,6
377,Addepar,2.17,2021-06-15 00:00:00,United States,Mountain View,Fintech,"8VC, D1 Capital Partners, Sway Ventures",2009,513930000,18,5,6,15,2021,12
378,Neo4j,2.15,2021-06-17 00:00:00,United States,San Mateo,Data management & analytics,"Eight Roads Ventures, One Peak Partners, Creandum",2007,581100000,18,4,6,17,2021,14
379,CloudWalk,2.15,2021-09-08 00:00:00,Brazil,Sao Paulo,Fintech,"Plug and Play Ventures, Valor Capital Group, DST Global",2013,345000000,14,1,9,8,2021,8
380,FirstCry,2.1,2020-02-07 00:00:00,India,Pune,E-commerce & direct-to-consumer,"SoftBank Group, SAIF Partners India, Valiant Capital Partners",2010,831000000,15,6,2,7,2020,10
381,Eightfold.ai,2.1,2020-10-27 00:00:00,United States,Santa Clara,Internet software & services,"Foundation Capital, Institutional Venture Partners, General Catalyst",2016,397000000,6,3,10,27,2020,4
382,Webflow,2.1,2021-01-13 00:00:00,United States,San Francisco,Internet software & services,"Accel, Silversmith Capital Partners, capitalG",2012,214920000,9,2,1,13,2021,9
383,Urban Company,2.1,2021-04-27 00:00:00,India,Gurgaon,E-commerce & direct-to-consumer,"VY Capital, Accel, Elevation Capital",2014,441240000,17,7,4,27,2021,7
385,Moveworks,2.1,2021-06-30 00:00:00,United States,Mountain View,Artificial Intelligence,"Lightspeed Venture Partners, Sapphire Ventures, Kleiner Perkins Caufield & Byers",2016,305000000,11,1,6,30,2021,5
386,Medable,2.1,2021-10-26 00:00:00,United States,Palo Alto,Internet software & services,"GSR Ventures, Sapphire Ventures, Streamlined Ventures",2013,533750000,13,2,10,26,2021,8
387,SoundHound,2.1,2018-05-03 00:00:00,United States,Santa Clara,Artificial Intelligence,"Tencent Holdings, Walden Venture Capital, Global Catalyst Partnera",2005,214100000,24,8,5,3,2018,13
388,GoCardless,2.1,2022-02-08 00:00:00,United Kingdom,London,Fintech,"Accel, Passion Capital, Balderton Capital",2011,529320000,16,4,2,8,2022,11
389,Trendy Group International,2,2012-02-13 00:00:00,Hong Kong,Kowloon,Consumer & retail,L Capital Partners,1999,200000000,1,1,2,13,2012,13
390,Avant,2,2012-12-17 00:00:00,United States,Chicago,Artificial Intelligence,"RRE Ventures, Tiger Global, August Capital",1973,1730000000,14,6,12,17,2012,39
392,BlaBlaCar,2,2015-09-16 00:00:00,France,Paris,Auto & transportation,"Accel Partners, Index Ventures, Insight Venture Partners",2006,564300000,13,6,9,16,2015,9
393,HuiMin,2,2016-09-05 00:00:00,China,Beijing,E-commerce & direct-to-consumer,"Zheshang Venture Capital, GP Capital, Western Capital Management",2013,519630000,13,1,9,5,2016,3
394,Quora,2,2017-04-21 00:00:00,United States,Mountain View,Internet software & services,"Y Combinator, Matrix Partners, Benchmark",2009,286000000,10,5,4,21,2017,8
395,Improbable,2,2017-05-11 00:00:00,United Kingdom,London,Other,"Andreessen Horowitz, SoftBank Group, Temasek Holdings",2012,603930000,7,4,5,11,2017,5
396,Preferred Networks,2,2018-05-17 00:00:00,Japan,Tokyo,Artificial Intelligence,"Toyota Motor Corporation, Mizuho Financial Group, FANUC",2014,152190000,11,2,5,17,2018,4
397,Formlabs,2,2018-08-01 00:00:00,United States,Somerville,Hardware,"Pitango Venture Capital, DFJ Growth Fund, Foundry Group",2011,261250000,24,6,8,1,2018,7
398,4Paradigm,2,2018-12-19 00:00:00,China,Beijing,Artificial Intelligence,"Sequoia Capital China, China Construction Bank, Bank of China",2015,930000000,39,2,12,19,2018,3
399,Calm,2,2019-02-06 00:00:00,United States,San Francisco,Consumer & retail,"Insight Venture Partners, TPG Growth, Sound Ventures",2012,217980000,28,4,2,6,2019,7
400,Kaseya,2,2019-03-27 00:00:00,United States,Miami,Cybersecurity,"Insight Partners, TPG Alternative & Renewable Technologies, Ireland Strategic Investment Fund",2000,617570000,3,1,3,27,2019,19
401,Mafengwo,2,2019-05-23 00:00:00,China,Beijing,Travel,"Qiming Venture Partners, Capital Today, General Atlantic",2010,488000000,13,1,5,23,2019,9
402,Druva,2,2019-06-20 00:00:00,United States,Sunnyvale,Data management & analytics,"Nexus Venture Partners, Tenaya Capital, Sequoia Capital",2007,475000000,16,4,6,20,2019,12
403,Kujiale,2,2019-10-25 00:00:00,China,Hangzhou,Internet software & services,"GGV Capital, IDG Capital, Linear Venture",2011,312000000,15,5,10,25,2019,8
404,AppsFlyer,2,2020-01-21 00:00:00,United States,San Francisco,Mobile & telecommunications,"Magma Venture Partners, Pitango Venture Capital, Qumra Capital",2011,303100000,8,4,1,21,2020,9
405,Keep,2,2020-05-19 00:00:00,China,Beijing,Mobile & telecommunications,"Bertelsmann Asia Investments, GGV Capital, Morningside Venture Capital",2014,614490000,11,2,5,19,2020,6
406,Redis Labs,2,2020-08-25 00:00:00,United States,Mountain View,Data management & analytics,"Viola Ventures, Dell Technologies Capital, Bain Capital Ventures",2011,355000000,13,5,8,25,2020,9
407,Xingyun Group,2,2020-09-24 00:00:00,China,Shenzhen,E-commerce & direct-to-consumer,"Matrix Partners China, Eastern Bell Capital, Hongtai Capital Holdings",2015,953500000,29,1,9,24,2020,5
408,Unqork,2,2020-10-06 00:00:00,United States,New York,Fintech,"Blackrock, capitalG, World Lab Innovation",2017,367170000,14,1,10,6,2020,3
409,Virta Health,2,2020-12-02 00:00:00,United States,San Francisco,Health,"Caffeinated Capital, Obvious Ventures, Venrock",2015,376500000,15,3,12,2,2020,5
411,Earnix,2,2021-02-21 00:00:00,Israel,Giv'atayim,Fintech,"Jerusalem Venture Partners, Israel Growth Partners, Insight Partners",2001,98500000,6,2,2,21,2021,20
412,Guoquan Shihui,2,2021-03-17 00:00:00,China,Shanghai,Consumer & retail,"Tiantu Capital, CMB International Capital, Vision Knight Capital",2017,423440000,9,2,3,17,2021,4
413,Arrail Dental,1.05,2021-04-13 00:00:00,China,Beijing,Health,"Qiming Venture Partners, Kleiner Perkins Caufield & Byers, OrbiMed Advisors",1999,449000000,15,7,4,13,2021,22
414,Clearco,2,2021-04-20 00:00:00,Canada,Toronto,Fintech,"Highland Capital Partners, Oak HC/FT Partners, Emergence Capital Partners",2015,935010000,23,1,4,20,2021,6
415,Hive,2,2021-04-21 00:00:00,United States,San Francisco,Artificial Intelligence,"Tomales Bay Capital, Bain & Company, General Catalyst",2013,85000000,5,1,4,21,2021,8
416,KRY,2,2021-04-27 00:00:00,Sweden,Stockholm,Health,"Index Ventures, Creandum, Accel",2014,570990000,10,3,4,27,2021,7
417,Kajabi,2,2021-05-04 00:00:00,United States,Irvine,Internet software & services,"Meritech Capital Partners, Tiger Global Management, Spectrum Equity",2010,550000000,6,1,5,4,2021,11
418,Ethos,2.7,2021-05-11 00:00:00,United States,San Francisco,Fintech,"Sequoia Capital, Google Ventures, Accel",2019,520000,1,,5,11,2021,2
419,PayFit,2.1,2022-01-06 00:00:00,United Kingdom,London,Fintech,"Accel, frst, Kima Ventures",2016,497240000,13,3,1,6,2022,6
420,Beisen,2,2021-05-11 00:00:00,China,Beijing,Internet software & services,"Matrix Partners China, Sequoia Capital China, Genesis Capital",2002,421180000,18,2,5,11,2021,19
421,Pipe,2,2021-05-19 00:00:00,United States,Miami,Fintech,"next47, MaC Venture Capital, FinVC",2019,366000000,36,1,5,19,2021,2
422,Iterable,2,2021-06-15 00:00:00,United States,San Francisco,Internet software & services,"CRV, Blue Cloud Ventures, Index Ventures",2013,342400000,18,4,6,15,2021,8
423,Bunq,2,2021-06-18 00:00:00,Netherlands,Amsterdam,Fintech,Undisclosed,2013,228000000,1,1,6,18,2021,8
424,Clip,2,2021-06-10 00:00:00,Mexico,Mexico City,Fintech,"Alta Ventures Mexico, General Atlantic, SoftBank Group",2012,397360000,15,4,6,10,2021,9
425,Loggi,2,2019-06-05 00:00:00,Brazil,Sao Paulo,"Supply chain, logistics, & delivery","Qualcomm Ventures, SoftBank Group. Monashees+",2013,484320000,15,4,6,5,2019,6
426,MURAL,2,2021-07-20 00:00:00,United States,San Francisco,Internet software & services,"Insight Partners, Tiger Global Management, Gradient Ventures",2011,192270000,15,5,7,20,2021,10
427,Pagaya,2,2020-06-17 00:00:00,Israel,Tel Aviv,Fintech,"Oak HC/FT Partners, GF Investments, Harvey Golub Family Office",2015,417250000,15,3,6,17,2020,5
428,OCSiAl,2,2019-03-04 00:00:00,Luxembourg,Leudelange,Other,"A&NN, Rusnano",2012,5000000,3,2,3,4,2019,7
429,XtalPi,2,2021-08-11 00:00:00,China,Shenzhen,Artificial Intelligence,"Tencent Holdings, 5Y Capital, Sequoia Capital China",2014,783810000,30,3,8,11,2021,7
430,Divvy Homes,2,2021-08-13 00:00:00,United States,San Francisco,Fintech,"Andreessen Horowitz, Caffeinated Capital, SciFi VC",2017,1127000000,16,1,8,13,2021,4
431,Apeel Sciences,2,2020-05-26 00:00:00,United States,Goleta,Other,"Upfront Ventures, Tao Capital Partners, Andreessen Horowitz",2012,640000000,25,6,5,26,2020,8
432,Opay,2,2021-08-23 00:00:00,Nigeria,Lagos,Fintech,"Sequoia Capital China, Source Code Capital, Redpoint Ventures China",2018,570000000,13,1,8,23,2021,3
433,Aviatrix,2,2021-09-08 00:00:00,United States,Santa Clara,Internet software & services,"Ignition Partners, Formation 8, CRV",2014,340000000,12,4,9,8,2021,7
434,SmartNews,2,2019-08-05 00:00:00,Japan,Tokyo,Mobile & telecommunications,"Japan Post Capital, Globis Capital Partners, Atomico",2012,409600000,20,7,8,5,2019,7
435,Misfits Market,2,2021-04-21 00:00:00,United States,Pennsauken,E-commerce & direct-to-consumer,"Accel, D1 Capita Partners, Greenoaks Capital Management",2018,526500000,9,2,4,21,2021,3
436,Spring Health,2,2021-09-16 00:00:00,United States,New York,Health,"Rethink Impact, Work-Bench, RRE Ventures",2016,296200000,25,3,9,16,2021,5
437,Black Sesame Technologies,2,2021-09-22 00:00:00,China,Shanghai,Artificial Intelligence,"Northern Light Venture Capital, Xiaomi, FutureX Capital",2016,115000000,18,1,9,22,2021,5
439,Modern Treasury,2,2021-10-06 00:00:00,United States,San Francisco,Fintech,"Benchmark, Altimeter Capital, Quiet Capital",2018,133120000,5,1,10,6,2021,3
440,Magic Leap,2,2014-10-21 00:00:00,United States,Plantation,Hardware,"Obvious Ventures, Qualcomm Ventures, Andreessen Horowitz",2010,3484000000,26,7,10,21,2014,4
441,Tier,2,2021-10-25 00:00:00,Germany,Berlin,Travel,"Northzone Ventures, White Star Capital, Novator Partners",2018,667380000,20,2,10,25,2021,3
442,Aiven,2,2021-10-18 00:00:00,Finland,Helsinki,Internet software & services,"Institutional Venture Partners, Atomico, Earlybird Venture Capital",2016,209930000,14,2,10,18,2021,5
443,ClickHouse,2,2021-10-28 00:00:00,United States,Portola Valley,Data management & analytics,"Lightspeed Venture Partners, Almaz Capital Partners, Altimeter Capital",2021,300000000,11,1,10,28,2021,0
444,Mynt,2,2021-10-28 00:00:00,Philippines,Taguig City,Fintech,"Insight Partners, Warburg Pincus, Ayala Corporation",2015,475000000,7,1,10,28,2021,6
445,Everlaw,2,2021-11-02 00:00:00,United States,Oakland,Internet software & services,"K9 Ventures, Menlo Ventures, Andreessen Horowitz",2010,314610000,7,5,11,2,2021,11
446,Zilch,2,2021-11-10 00:00:00,United Kingdom,London,Fintech,"Gauss Ventures, Ventura Capital, dmg ventures",2018,339200000,6,2,11,10,2021,3
447,VerbIT,2,2021-06-08 00:00:00,United States,New York,Artificial Intelligence,"ClalTech, Vertex Ventures, Oryzn Capital",2016,532000000,23,2,6,8,2021,5
448,StarkWare,2,2021-11-17 00:00:00,Israel,Netanya,Cybersecurity,"Sequoia Capital, Paradigm, Pantera Capital",2018,167700000,20,1,11,17,2021,3
450,Deliverr,2,2021-11-22 00:00:00,United States,San Francisco,"Supply chain, logistics, & delivery","8VC, Activant Capital, GLP Capital Partners",2017,490100000,10,2,11,22,2021,4
451,SWORD Health,2,2021-11-22 00:00:00,United States,New York,Health,"Khosla Ventures, Green Innovations, Founders Fund",2015,322160000,20,2,11,22,2021,6
452,LTK,2,2021-11-22 00:00:00,United States,Dallas,Internet software & services,"SoftBank Group, Maverick Capital",2011,315000000,5,2,11,22,2021,10
453,Exotec,2,2022-01-17 00:00:00,France,Croix,Hardware,"Breega Capital, Iris Capital, 360 Capital Partners",2015,446700000,7,3,1,17,2022,7
454,Dremio,2,2021-01-06 00:00:00,United States,Santa Clara,Data management & analytics,"Lightspeed Venture Partners, Redpoint Ventures, Norwest Venture Partners",2015,405000000,9,4,1,6,2021,6
455,Akulaku,2,2022-02-15 00:00:00,Indonesia,Jakarta,E-commerce & direct-to-consumer,"DCM Ventures, IDG Capital, Siam Commercial Bank",2014,455000000,15,3,2,15,2022,8
457,Fenbi Education,1.95,2021-02-07 00:00:00,China,Beijing,Edtech,"Trustbridge Partners, Hony Capital, IDG Capital",2015,390000000,8,1,2,7,2021,6
458,Starling Bank,1.95,2021-03-08 00:00:00,United Kingdom,London,Fintech,"JTC Group, Qatar Investment Authority, Fidelity Investment",2014,905620000,11,2,3,8,2021,7
459,Rokt,1.95,2021-12-16 00:00:00,United States,New York,Internet software & services,"Square Peg Capital, TDM Growth Partners, Tiger Global Management",2012,488500000,12,4,12,16,2021,9
460,InVision,1.9,2017-11-01 00:00:00,United States,New York,Internet software & services,"FirstMark Capital, Tiger Global Management, ICONIQ Capital",2011,350710000,9,5,11,1,2017,6
462,MX Technologies,1.9,2021-01-13 00:00:00,United States,Lehi,Fintech,"Point72 Ventures, Pelion Venture Partners, Commerce Ventures",2010,454130000,31,2,1,13,2021,11
463,Aledade,1.9,2021-01-19 00:00:00,United States,Bethesda,Health,"Venrock, CVF Capital Partners, ARCH Venture Partners",2014,294650000,13,2,1,19,2021,7
464,CoinSwitch Kuber,1.9,2021-10-06 00:00:00,India,Bangalore,Fintech,"Tiger Global Management, Sequoia Capital India, Ribbit Capital",2017,300000000,7,2,10,6,2021,4
465,ENOVATE,1.85,2019-04-15 00:00:00,China,Shanghai,Auto & transportation,Automobile Industry Guidance Fund,2015,1333000000,1,1,4,15,2019,4
466,CFGI,1.85,2021-09-15 00:00:00,United States,Boston,Fintech,"The Carlyle Group, CVC Capital Partners",2000,18580000,2,1,9,15,2021,21
467,Retool,1.85,2021-12-22 00:00:00,United States,San Francisco,Internet software & services,Sequoia Capital,2000,18580000,2,1,12,22,2021,21
468,Automattic,1.8,2013-05-27 00:00:00,United States,San Francisco,Internet software & services,"Insight Venture Partners, Lowercase Capital, Polaris Partners",2005,861690000,22,7,5,27,2013,8
469,ZocDoc,1.8,2015-08-20 00:00:00,United States,New York,Health,"Founders Fund, Khosla Ventures, Goldman Sachs",2007,383020000,15,4,8,20,2015,8
470,Diamond Foundry,1.8,2021-03-29 00:00:00,United States,San Francisco,Other,"Fashion Tech Lab, Fidelity Investments, Vast Ventures",2012,300000000,16,1,3,29,2021,9
471,FullStory,1.8,2021-08-04 00:00:00,United States,Atlanta,Internet software & services,"Google Ventures, Kleiner Perkins Caufield & Byers, Stripes Group",2014,170200000,9,4,8,4,2021,7
472,Lightricks,1.8,2019-07-31 00:00:00,Israel,Jerusalem,Artificial Intelligence,"Viola Ventures, Insight Partners, ClalTech, Goldman Sachs",2013,335000000,16,3,7,31,2019,6
473,Opentrons,1.8,2021-09-23 00:00:00,United States,New York,Hardware,"SOSV, Khosla Ventures, Lerer Hippeau",2016,250830000,8,2,9,23,2021,5
474,AIWAYS,1.78,2018-04-16 00:00:00,China,Shanghai,Auto & transportation,"Jiangsu Sha Steel Group, Shanghai Puyin Industry, Funa Yuanchuang Technology",2017,330930000,10,1,4,16,2018,1
475,Trulioo,1.75,2021-06-07 00:00:00,Canada,Vancouver,Cybersecurity,"Blumberg Capital, American Express Ventures, BDC Venture Capital",2011,469740000,12,3,6,7,2021,10
476,Spinny,1.75,2021-11-24 00:00:00,India,Gurugram,E-commerce & direct-to-consumer,"General Catalyst, Eleation Capital, Avenir Growth Capital",2015,515900000,20,5,11,24,2021,6
477,Orca Security,1.8,2021-03-23 00:00:00,United States,Portland,Cybersecurity,"YL Ventures, Redpoint Ventures, GGV Capital",2019,632000000,15,2,3,23,2021,2
478,Apus Group,1.73,2015-01-16 00:00:00,China,Beijing,Mobile & telecommunications,"Redpoint Ventures, QiMing Venture Partners, Chengwei Capital",2014,116300000,6,2,1,16,2015,1
479,Harry's,1.7,2018-02-16 00:00:00,United States,New York,Consumer & retail,"Thrive Capital, Tiger Global Management, Temasek",2013,659100000,25,5,2,16,2018,5
480,PAX,1.7,2018-10-22 00:00:00,United States,San Francisco,Consumer & retail,"Tao Capital Partners, Global Asset Capital, Tiger Global Management",2007,544930000,10,3,10,22,2018,11
482,DispatchHealth,1.7,2021-03-03 00:00:00,United States,Denver,Health,"Alta Partners, Questa Capital, Echo Health Venturesl",2013,406960000,9,2,3,3,2021,8
483,Unite Us,1.7,2021-03-17 00:00:00,United States,New York,Health,"Insight Partners, Sequoia Capital, Index Ventures",2014,195300000,15,3,3,17,2021,7
484,CircleCI,1.7,2021-05-11 00:00:00,United States,San Francisco,Internet software & services,"Threshold Ventures, Baseline Ventures, Harrison Metal",2011,312500000,26,3,5,11,2021,10
486,Vestiaire Collective,1.7,2021-03-01 00:00:00,France,Paris,E-commerce & direct-to-consumer,"Eurazeo, IDInvest Partners, Balderton Capital",2009,664450000,17,4,3,1,2021,12
487,Dragos,1.7,2021-10-28 00:00:00,United States,Hanover,Cybersecurity,"DataTribe, Energy Impact Partners, AllegisCyber Capital",2016,364200000,13,2,10,28,2021,5
488,Reltio,1.7,2021-11-04 00:00:00,United States,Redwood City,Data management & analytics,"Crosslink Capital, .406 Ventures, Sapphire Ventures",2011,240500000,9,4,11,4,2021,10
489,H2O.ai,1.7,2021-11-07 00:00:00,United States,Mountain View,Artificial Intelligence,"Nexus Venture Partners, Transamerica Ventures, Crane Venture Partners",2011,246120000,21,4,11,7,2021,10
490,ZenBusiness,1.7,2021-11-09 00:00:00,United States,Austin,Fintech,"Greycroft, Lerer Hippeau, Geekdom Fund",2015,275750000,19,1,11,9,2021,6
491,Carsome,1.7,2021-07-12 00:00:00,Malaysia,Selangor,E-commerce & direct-to-consumer,"Gobi Partners, 500 Startups, Ondine Capital",2015,597350000,24,5,7,12,2021,6
492,Productboard,1.7,2022-02-02 00:00:00,United States,San Francisco,Internet software & services,"Index Ventures, Kleiner Perkins Caufield & Byers, Bessemer Venture Partners",2014,261300000,13,4,2,2,2022,8
493,Spotter,1.7,2022-02-16 00:00:00,United States,Los Angeles,Fintech,"SoftBank Group, Access Industries, Crossbeam Venture Partners",2019,220650000,6,1,2,16,2022,3
494,Alan,1.68,2021-04-19 00:00:00,France,Paris,Fintech,"Index Ventures, Temasek, Portag3 Ventures",2016,363170000,13,2,4,19,2021,5
495,wefox,1.65,2019-03-05 00:00:00,Germany,Berlin,Fintech,"Salesforce Ventures, Seedcamp, OMERS Ventures",2014,924310000,36,3,3,5,2019,5
496,Hibob,1.65,2021-10-12 00:00:00,Israel,Tel Aviv,Internet software & services,"Bessemer Venture Partners, Eight Roads Ventures, Battery Ventures",2015,265000000,15,3,10,12,2021,6
497,Trader Interactive,1.63,2021-05-12 00:00:00,United States,Norfolk,Other,Carsales,2015,265000000,15,3,5,12,2021,6
498,Jusfoun Big Data,1.62,2018-07-09 00:00:00,China,Beijing,Data management & analytics,"Boxin Capital, DT Capital Partners, IDG Capital",2010,137130000,27,3,7,9,2018,8
