499,Transcarent,1.62,2022-01-11 00:00:00,United States,San Francisco,Health,"Alta Partners, General Catalyst, Jove Equity Partners",2020,298000000,15,1,1,11,2022,2
500,DealShare,1.7,2022-01-27 00:00:00,India,Bengaluru,E-commerce & direct-to-consumer,"Alpha Wave Global, Matrix Partners India, Tiger Global Management",2018,391520000,19,4,1,27,2022,4
502,solarisBank,1.65,2021-07-13 00:00:00,Germany,Berlin,Fintech,"Yabeo Capital, SBI Investment, Vulcan Capital",2016,402460000,20,5,7,13,2021,5
503,Infinidat,1.6,2015-04-29 00:00:00,United States,Waltham,Hardware,"TPG Growth, Goldman Sachs",2011,325000000,6,3,4,29,2015,4
504,Afiniti,1.6,2017-04-14 00:00:00,Bermuda,Hamilton,Artificial Intelligence,GAM Holding,2006,327200000,10,3,4,14,2017,11
505,Cao Cao Mobility,1.6,2018-01-17 00:00:00,China,Hangzhou,Auto & transportation,"People Electrical Appliance Group China, Zhongrong International Trust",2015,968860000,5,1,1,17,2018,3
506,Verkada,1.6,2020-01-29 00:00:00,United States,San Mateo,Cybersecurity,"next47, First Round Capital, Sequoia Capital",2016,139640000,7,3,1,29,2020,4
507,Clari,2.6,2021-03-03 00:00:00,United States,Sunnyvale,Internet software & services,"Sequoia Capital, Bain Capital Ventures, enaya Capital",2012,496000000,15,4,3,3,2021,9
508,Tonal,1.6,2021-03-31 00:00:00,United States,San Francisco,E-commerce & direct-to-consumer,"Mayfield Fund, Shasta Ventures, L Catterton",2015,431400000,27,2,3,31,2021,6
509,Clio,1.6,2021-04-27 00:00:00,Canada,Burnaby,Internet software & services,"OMERS Private Equity, T. Rowe Price, Technology Crossover Ventures",2008,415790000,10,2,4,27,2021,13
510,SafetyCulture,1.6,2021-05-03 00:00:00,Australia,Sydney,Internet software & services,"Blackbird Ventures, IndexVentures, Tiger Global Management",2004,222810000,12,6,5,3,2021,17
511,Extend,1.6,2021-05-18 00:00:00,United States,San Francisco,Fintech,"GreatPoint Ventures, Meritech Capital Partners, PayPal Ventures",2004,222810000,12,6,5,18,2021,17
512,Cognite,1.5,2021-05-19 00:00:00,Norway,Lysaker,Data management & analytics,"Technology Crossover Ventures, Accel, Aker",2016,346800000,5,3,5,19,2021,5
513,ASAPP,1.6,2021-05-19 00:00:00,United States,New York,Artificial Intelligence,"March Capital Partners, HOF Capital, Emergence Capital Partners",2014,312570000,13,2,5,19,2021,7
514,SmartHR,1.6,2021-06-08 00:00:00,Japan,Tokyo,Fintech,"BEENEXT, World Innovation Lab, Light Street Capital",2013,222340000,20,3,6,8,2021,8
515,Mercury,1.6,2021-07-03 00:00:00,United States,San Francisco,Fintech,"Andreessen Horowitz, Coatue Management, Clocktower Technology Ventures",2019,150930000,39,2,7,3,2021,2
516,HomeLight,1.6,2021-09-02 00:00:00,United States,San Francisco,Fintech,"Zeev Ventures, Menlo Ventures,Crosslink Capital",2012,539600000,19,5,9,2,2021,9
517,Truepill,1.6,2021-10-27 00:00:00,United States,Hayward,Health,"Initialized Capital, Sound Ventures, TI Platform Management",2016,256060000,12,2,10,27,2021,5
518,ezCater,1.6,2019-04-02 00:00:00,United States,Boston,"Supply chain, logistics, & delivery","Insight Venture Partners, ICONIQ Capital, Launchpad Venture Group",2007,420160000,21,9,4,2,2019,12
519,Wayflyer,1.6,2022-02-01 00:00:00,Ireland,Dublin,Fintech,"QED Investors, DST Global, Left Lane Capital",2019,336200000,11,1,2,1,2022,3
520,Promasidor Holdings,1.59,2016-11-08 00:00:00,South Africa,Bryanston,Consumer & retail,"IFC, Ajinomoto",1979,556000000,2,1,11,8,2016,37
521,Baiwang,1.55,2019-03-25 00:00:00,China,Beijing,Fintech,"Guozhong Venture Capital Management, Shenzhen Capital Group, Oriental Fortune Capital",2015,224350000,8,1,3,25,2019,4
522,Iluvatar CoreX,1.55,2021-03-01 00:00:00,China,Shanghai,Hardware,"Centurium Capital, Cedarlake Capital, Unicom Innovation Venture Capital",2015,185520000,8,1,3,1,2021,6
523,Wenheyou,1.55,2021-04-17 00:00:00,China,Hunan,Other,"Sequoia Capital China, Warburg Pincus, IDG Capital",2013,92440000,7,2,4,17,2021,8
524,Loom,1.53,2021-05-20 00:00:00,United States,San Francisco,Internet software & services,"Kleiner Perkins Caufield & Byers, Sequoia Capital, General Catalyst",2016,198480000,15,2,5,20,2021,5
525,Ximalaya FM,1.52,2017-09-22 00:00:00,China,Shanghai,Mobile & telecommunications,"China Creation Ventures, Sierra Ventures, Xingwang Investment Management",2012,70590000,11,2,9,22,2017,5
527,Mu Sigma,1.5,2013-02-07 00:00:00,United States,Northbrook,Data management & analytics,"Sequoia Capital, General Atlantic",2004,208000000,8,4,2,7,2013,9
528,TuJia,1.5,2015-06-17 00:00:00,China,Beijing,Travel,"GGV Capital, QiMing Venture Partnersl",2011,763700000,13,2,6,17,2015,4
529,Mofang Living,1.5,2016-04-13 00:00:00,China,Shanghai,E-commerce & direct-to-consumer,"Warburg Pincus, Aviation Industry Corporation of China",2009,710000000,4,1,4,13,2016,7
530,Gett,1.5,2016-05-24 00:00:00,United Kingdom,London,Auto & transportation,"Volkswagen, Access Industries, Vostok New Ventures",2010,1057000000,11,9,5,24,2016,6
531,DT Dream,1.5,2017-06-08 00:00:00,China,Hangzhou,Data management & analytics,"Alibaba Group, China Everbright Investment Management, Yinxinggu Capital",2015,260350000,5,2,6,8,2017,2
533,XiaoZhu,1.5,2017-11-01 00:00:00,China,Beijing,Travel,"Morningside Ventures, Capital Today, JOY Capital",2012,500000000,12,1,11,1,2017,5
534,JOLLY Information Technology,1.5,2018-05-29 00:00:00,China,Hangzhou,E-commerce & direct-to-consumer,"Legend Capital, CDH Investments, Sequoia Capital China",2008,100120000,10,1,5,29,2018,10
535,Yijiupi,1.5,2018-09-20 00:00:00,China,Beijing,Consumer & retail,"Source Code Capital, Meituan Dianping, Tencent Holdings",2014,547270000,13,3,9,20,2018,4
536,Cambridge Mobile Telematics,1.5,2018-12-19 00:00:00,United States,Cambridge,Mobile & telecommunications,SoftBank Group,2010,502500000,1,,12,19,2018,8
537,Collective Health,1.5,2019-06-17 00:00:00,United States,San Francisco,Fintech,"New Enterprise Associates, Founders Fund, Google Ventures",2013,714000000,27,4,6,17,2019,6
538,Strava,1.5,2020-11-16 00:00:00,United States,San Francisco,Internet software & services,"Jackson Square Ventures, Madrone Capital Partners, Sequoia Capital",2009,179850000,7,6,11,16,2020,11
539,Zenoti,1.5,2020-12-15 00:00:00,United States,Bellevue,Internet software & services,"Norwest Venture Partners, Accel, Tiger Global Management",2010,341680000,9,4,12,15,2020,10
540,K Health,1.5,2021-01-19 00:00:00,United States,New York,Health,"Max Ventures, Mangrove Capital Partners, 14W",2016,278000000,19,1,1,19,2021,5
542,ID.me,1.5,2021-03-19 00:00:00,United States,McLean,Cybersecurity,"Moonshots Capital, BoxGroup, Blu Venture Investors",2010,273070000,31,3,3,19,2021,11
543,Snapdocs,1.5,2021-05-25 00:00:00,United States,San Francisco,Fintech,"Sequoia Capital, Y Combinator, F-Prime Capital",2012,250000000,13,1,5,25,2021,9
544,Chipper Cash,2,2021-06-01 00:00:00,United States,San Francisco,Fintech,"Deciens Capital, Bezos Expeditions, 500 Startups",2017,302600000,15,3,6,1,2021,4
545,Ledger,1.5,2021-06-10 00:00:00,France,Paris,Hardware,"Digital Currency Group, Draper Esprit, Korelya Capital",2014,466380000,46,4,6,10,2021,7
546,Next Silicon,1.5,2021-06-14 00:00:00,Israel,Tel Aviv,Hardware,"Amiti Ventures, Playground Global, Aleph",2018,226600000,9,1,6,14,2021,3
547,YunQuNa,1.5,2021-06-29 00:00:00,China,Shanghai,"Supply chain, logistics, & delivery","Source Code Capital, Coatue Management, DCM Ventures",2015,342370000,10,1,6,29,2021,6
548,Impact,1.5,2021-07-13 00:00:00,United States,Santa Barbara,Internet software & services,"Redpoint Ventures, Providence Equity Partners, Silversmith Capital Partners",2008,274150000,6,2,7,13,2021,13
549,SmartRecruiters,1.5,2021-07-20 00:00:00,United States,San Francisco,Internet software & services,"Mayfield Fund, Insight Partners, Rembrandt Venture Partners",2010,214550000,7,4,7,20,2021,11
550,NotCo,1.5,2021-07-26 00:00:00,Chile,Santiago,Artificial Intelligence,"Kaszek Ventures, SOSV, Tiger Global Management",2015,395840000,18,1,7,26,2021,6
551,Culture Amp,1.5,2021-07-29 00:00:00,Australia,Richmond,Internet software & services,"Felicis Ventures, Index Ventures, Blackbird Ventures",2011,258300000,12,4,7,29,2021,10
552,TaxBit,1.5,2021-08-04 00:00:00,United States,Draper,Fintech,"Insight Partners, Coinbase Ventures, PayPal Ventures",2018,235750000,21,1,8,4,2021,3
553,Pacaso,1.5,2021-03-24 00:00:00,United States,Cincinnati,Fintech,"Global Founders Capital, Shea Ventures, Greycroft",2020,1467000000,16,2,3,24,2021,1
554,1047 Games,1.5,2021-09-14 00:00:00,United States,Zephyr Cove,Internet software & services,"VGames, Lakestar, Galaxy Interactive",2017,126500000,10,1,9,14,2021,4
555,Matillion,1.5,2021-09-15 00:00:00,United Kingdom,Altrincham,Data management & analytics,"Scale Venture Partners, Sapphire Ventures, Battery Ventures",2011,310320000,8,2,9,15,2021,10
556,Persona,1.5,2021-09-15 00:00:00,United States,San Francisco,Cybersecurity,"Coatue Management, Index Ventures, Founders Fund",2018,217500000,6,1,9,15,2021,3
557,Whatnot,1.5,2021-09-16 00:00:00,United States,Marina del Rey,E-commerce & direct-to-consumer,"Y Combinator, Andreessen Horowitz, Wonder Ventures",2019,224150000,22,1,9,16,2021,2
558,Ascend Money,1.5,2021-09-27 00:00:00,Thailand,Bangkok,Fintech,"Ant Group, Charoen Pokphand Group, Bow Wave Capital",2013,150000000,3,1,9,27,2021,8
559,Andela,1.5,2021-09-29 00:00:00,United States,New York,Internet software & services,"Spark Capital, Google Ventures, CRE Venture Capital",2014,374610000,29,4,9,29,2021,7
560,Built,1.5,2021-09-30 00:00:00,United States,Nashville,Internet software & services,"Nyca Partners, Index Ventures, Technology Crossover Ventures",2015,268120000,22,3,9,30,2021,6
561,candy.com,1.5,2021-10-21 00:00:00,United States,New York,Fintech,"Insight Partners, Softbank Group, Connect Ventures",2021,100000000,9,1,10,21,2021,0
562,Devo,1.5,2021-10-26 00:00:00,United States,Cambridge,Data management & analytics,"Insight Partners, Kibo Ventures, Bessemer Venture Partners",2011,381000000,10,3,10,26,2021,10
563,CoinList,1.5,2021-10-15 00:00:00,United States,San Francisco,Fintech,"Accomplice, Polychain Capital, GoldenTree Asset Management",2017,169200000,21,2,10,15,2021,4
564,Lusha,1.5,2021-11-10 00:00:00,United States,New York,Internet software & services,"PSG, ION Crossover Partners",2016,245000000,2,1,11,10,2021,5
565,CureFit,1.5,2021-11-10 00:00:00,India,Bengaluru,Health,"Chiratae Ventures, Accel, Kalaari Capital",2016,679400000,42,5,11,10,2021,5
566,Solugen,1.5,2021-09-10 00:00:00,United States,Houston,Other,"Fifty Years Fund, Refactor Capital, Temasek",2016,443070000,20,1,9,10,2021,5
567,Olist,1.5,2021-12-15 00:00:00,Brazil,Curitiba,E-commerce & direct-to-consumer,"Redpoint e.ventures, Valor Capital Group, SoftBank Latin America Fund",2015,318750000,13,2,12,15,2021,6
568,Paradox,1.5,2021-12-27 00:00:00,United States,Scottsdale,Internet software & services,"Brighton Park Capital, Blue Cloud Ventures, Workday Ventures",2016,253460000,14,1,12,27,2021,5
569,Airbyte,1.5,2021-12-17 00:00:00,United States,San Francisco,Internet software & services,"Accel, Benchmark, SV Angel",2020,181350000,14,1,12,17,2021,1
570,StoreDot,1.5,2022-01-04 00:00:00,Israel,Herzliya,Other,"Samsung Ventures, SingulariTeam, BP Ventures",2012,206000000,14,4,1,4,2022,10
571,Il Makiage,1.5,2022-01-10 00:00:00,United States,New York,E-commerce & direct-to-consumer,"L Catterton, Franklin Templeton, First Light Capital Group",2018,29000000,5,1,1,10,2022,4
572,Spendesk,1.5,2022-01-18 00:00:00,France,Paris,Fintech,"Index Ventures, Eight Roads Ventures, General Atlantic",2015,300340000,14,2,1,18,2022,7
573,Veriff,1.5,2022-01-26 00:00:00,Estonia,Tallinn,Artificial Intelligence,"Accel, Institutional Venture Partners, Tiger Global Management",2015,192320000,15,2,1,26,2022,7
574,Athelas,1.5,2022-01-31 00:00:00,United States,Mountain View,Health,"Sequoia Capital, General Catalyst, 	Human Capital",2016,136080000,11,1,1,31,2022,6
575,ElasticRun,1.5,2022-02-07 00:00:00,India,Pune,"Supply chain, logistics, & delivery","Kalaari Capital, Norwest Venture Partners, Prosus Ventures",2016,432110000,9,4,2,7,2022,6
576,Veho,1.5,2021-12-21 00:00:00,United States,Boulder,"Supply chain, logistics, & delivery","General Catalyst, Origin Ventures, Fontinalis Partners",2016,299280000,12,2,12,21,2021,5
577,Temporal,1.5,2022-02-16 00:00:00,United States,Bellevue,Internet software & services,"Amplify Partners, Addition, Madrona Venture Group",2019,121750000,5,1,2,16,2022,3
578,Fabric,1.5,2022-02-24 00:00:00,United States,Bellevue,E-commerce & direct-to-consumer,"Redpoint Ventures, Norwest Venture Partners, Sierra Ventures",2017,292580000,11,2,2,24,2022,5
579,Yipin Shengxian,1.49,2019-03-11 00:00:00,China,Hefei,E-commerce & direct-to-consumer,"Eastern Bell Capital, Capital Today, Longzhu Capital",2017,658490000,4,,3,11,2019,2
580,Bordrin Motors,1.48,2019-06-03 00:00:00,China,Shanghai,Auto & transportation,"China Grand Prosperity Investment, CSC Group",2016,361000000,7,,6,3,2019,3
581,Coocaa,1.45,2018-03-16 00:00:00,China,Shenzhen,Hardware,"Baidu, Tencent Holdings",2006,226600000,4,3,3,16,2018,12
582,Juma Peisong,1.45,2018-11-26 00:00:00,China,Chengdu,"Supply chain, logistics, & delivery","Ding Xiang Capital, New Hope Fund, Sino-Ocean Capital",2011,281380000,7,,11,26,2018,7
583,Ouyeel,1.45,2019-06-27 00:00:00,China,Shanghai,Internet software & services,Taigang Venture Capital,2015,433720000,18,,6,27,2019,4
584,Gymshark,1.45,2020-08-14 00:00:00,United Kingdom,Solihull,E-commerce & direct-to-consumer,General Atlantic,2012,300000000,1,1,8,14,2020,8
585,Zeta,1.45,2021-05-24 00:00:00,United States,San Francisco,Fintech,"Sodexo Ventures, SoftBank Group",2015,303000000,5,3,5,24,2021,6
586,M1 Finance,1.45,2021-07-14 00:00:00,United States,Chicago,Fintech,"Left Lane Capital, Clocktower Technology Ventures, Jump Capital",2015,328170000,7,3,7,14,2021,6
587,Aleo,1.45,2022-02-07 00:00:00,United States,San Francisco,Cybersecurity,"Slow Ventures, Andreessen Horowitz, SoftBank Group",2019,228000000,18,1,2,7,2022,3
588,Einride,1.44,2021-12-31 00:00:00,Sweden,Stockholm,Auto & transportation,"Temasek,	BUILD Capital Partners, 	Northzone Ventures",2016,150820000,20,4,12,31,2021,5
589,Justworks,1.43,2020-01-28 00:00:00,United States,New York,Internet software & services,"Index Ventures, Thrive Capital, Bain Capital Ventures",2012,143000000,9,3,1,28,2020,8
590,SonderMind,1.42,2021-07-28 00:00:00,United States,Denver,Health,"Kickstart Fund, General Catalyst, Drive Capital",2014,276070000,18,,7,28,2021,7
591,Papa,1.4,2021-11-04 00:00:00,United States,Miami,Health,"Initialized Capital, Canaan Partners, Sound Ventures",2016,242050000,14,1,11,4,2021,5
592,Figment,1.4,2021-12-20 00:00:00,Canada,Toronto,Internet software & services,"Bonfire Ventures, Two Sigma Ventures, FJ Labs",2018,163840000,24,2,12,20,2021,3
593,Envoy,1.4,2022-01-11 00:00:00,United States,San Francisco,Internet software & services,"Andreessen Horowitz, Initialized Capital, TriplePoint Capital",2013,203500000,15,2,1,11,2022,9
594,Deliverect,1.4,2022-01-24 00:00:00,Belgium,Ghent,Fintech,"Newion Partners, SmartFin Capital, OMERS Ventures",2018,235890000,8,1,1,24,2022,4
595,SparkCognition,1.4,2022-01-25 00:00:00,United States,Austin,Artificial Intelligence,"March Capital Partners, Temasek, Doha Venture Capital",2013,290880000,34,4,1,25,2022,9
596,Firebolt,1.4,2022-01-26 00:00:00,Israel,Tel Aviv,Data management & analytics,"TLV Partners, Zeev Ventures, Bessemer Venture Partners",2019,264000000,9,1,1,26,2022,3
597,Koudai,1.4,2014-10-23 00:00:00,China,Beijing,E-commerce & direct-to-consumer,"New Enterprise Associates, Tiger Global management, Tencent",2010,362000000,11,1,10,23,2014,4
598,Symphony,1.4,2017-05-16 00:00:00,United States,New York,Fintech,"BNP Paribas, Goldman Sachs, Google",2014,461000000,26,4,5,16,2017,3
599,Yidian Zixun,1.4,2017-10-17 00:00:00,China,Beijing,Mobile & telecommunications,"Phoenix New Media, Tianjin Haihe Industry Fund",2021,15000000,2,,10,17,2017,-4
600,Cabify,1.4,2018-01-22 00:00:00,Spain,Madrid,Auto & transportation,"Seaya Ventures, Otter Rock Capital, Rakuten",2011,481470000,22,4,1,22,2018,7
601,Hive Box,1.4,2018-01-23 00:00:00,China,Shenzhen,"Supply chain, logistics, & delivery","Eastern Bell Capital, SF Holding Co, STO Express",2015,1240000000,16,2,1,23,2018,3
602,Deezer,1.4,2018-08-02 00:00:00,France,Paris,Internet software & services,"Orange Digital Ventures, Access Industries",2007,481800000,11,3,8,2,2018,11
603,Away,1.4,2019-05-15 00:00:00,United States,New York,E-commerce & direct-to-consumer,"Global Founders Capital, Comcast Ventures, Forerunner Ventures",2015,181100000,11,4,5,15,2019,4
604,Kong,1.4,2020-12-31 00:00:00,United States,San Francisco,Internet software & services,"New Enterprise Associates, CRV, Index Ventures",2007,170500000,17,3,12,31,2020,13
605,Epidemic Sound,1.4,2021-03-11 00:00:00,Sweden,Stockholm,Internet software & services,"EQT Partners, Blackstone",2009,476140000,9,6,3,11,2021,12
606,Yotpo,1.4,2021-03-18 00:00:00,United States,New York,Internet software & services,"Bessemer Venture Partners, Vintage Investment Partners, Blumberg Capital",2011,436000000,20,3,3,18,2021,10
607,Rebel Foods,1.4,2021-10-07 00:00:00,India,Pune,E-commerce & direct-to-consumer,"Sequoia Capital India, Lightbox Ventures, Coatue Management",2011,495210000,18,7,10,7,2021,10
609,Five Star Business Finance,1.4,2021-03-26 00:00:00,India,Chennai,Other,"Sequoia Capital India, Tiger Global Management, Tencent",1984,459780000,7,4,3,26,2021,37
610,Stash,1.4,2021-02-03 00:00:00,United States,New York,Fintech,"Goodwater Capital, Entree Capital, Valar Ventures",2015,439250000,13,6,2,3,2021,6
611,Phenom People,1.4,2021-04-07 00:00:00,United States,Ambler,Internet software & services,"Sierra Ventures, AXA Venture Partners, Sigma Prime Ventures",2011,163020000,13,3,4,7,2021,10
612,GupShup,1.4,2021-04-08 00:00:00,United States,San Francisco,Internet software & services,"Helion Venture Partners, Tiger Global management, CRV",2011,163020000,13,3,4,8,2021,10
613,Degreed,1.4,2021-04-13 00:00:00,United States,Pleasanton,Edtech,"Signal Peak Ventures, Owl Ventures, Jump Capital",2012,385920000,14,3,4,13,2021,9
614,Astranis Space Technologies,1.4,2021-04-14 00:00:00,United States,San Francisco,Mobile & telecommunications,"Refactor Capital, Andreessen Horowitz, Fifty Years Fund",2015,358070000,26,2,4,14,2021,6
615,Scalable Capital,1.4,2021-06-08 00:00:00,Germany,Munich,Fintech,"BlackRock, Tengelmann Ventures, Holtzbrinck Ventures",2014,314280000,10,4,6,8,2021,7
616,VideoAmp,1.4,2021-10-21 00:00:00,United States,Los Angeles,Internet software & services,"Simon Equity Partners, Wavemaker Partners, Anthem Venture Partners",2014,437100000,18,3,10,21,2021,7
617,Panther Labs,1.4,2021-12-02 00:00:00,United States,San Francisco,Cybersecurity,"Innovation Endeavors, s28 Capital, Lightspeed Venture Partners",2018,140380000,8,1,12,2,2021,3
618,Salt Security,1.4,2022-02-10 00:00:00,United States,Palo Alto,Cybersecurity,"Y Combinator, S Capital, Tenaya Capital",2016,270740000,14,2,2,10,2022,6
619,Tripledot Studios,1.4,2022-02-14 00:00:00,United Kingdom,London,Mobile & telecommunications,"Lightspeed Venture Partners, Access Industries, Eldridge",2017,202000000,5,2,2,14,2022,5
621,Neon,1.38,2022-02-14 00:00:00,Brazil,Sao Paulo,Fintech,"Propel Venture Partners, Monashees+, BBVA",2016,720420000,16,2,2,14,2022,6
622,DeepBlue Technology,1.35,2018-04-16 00:00:00,China,Shanghai,Artificial Intelligence,"DESUN Capital, Yunfeng Capital, Meridian Capital",2014,79280000,10,,4,16,2018,4
623,Klook,1.35,2018-08-07 00:00:00,Hong Kong,Central,Travel,"Sequoia Capital China, Goldman Sachs, Matrix Partners China",2014,721190000,14,3,8,7,2018,4
624,Yaoshibang,1.35,2021-06-15 00:00:00,China,Guangzhou,Health,"Green Pine Capital Partners, Ivy Capital, DCM Ventures",2015,497190000,15,2,6,15,2021,6
625,At-Bay,1.35,2021-07-27 00:00:00,United States,Mountain View,Fintech,"Lightspeed Venture Partners, Khosla Ventures, Munich Re Ventures",2016,292000000,11,2,7,27,2021,5
626,Alloy,1.35,2021-09-30 00:00:00,United States,New York,Fintech,"Bessemer Venture Partners, Eniac Ventures, Canapi Ventures",2015,155920000,12,1,9,30,2021,6
627,Epirus,1.35,2022-02-14 00:00:00,United States,Hawthorne,Other,"8VC, Bedrock Capital, Broom Ventures",2018,287390000,18,1,2,14,2022,4
628,Signifyd,1.34,2021-04-15 00:00:00,United States,San Jose,Fintech,"Menlo Ventures, Resolute Ventures, IA Ventures",2011,411200000,19,7,4,15,2021,10
629,Motorway,1.33,2021-11-29 00:00:00,United Kingdom,London,E-commerce & direct-to-consumer,"Marchmont Ventures, BMW i Ventures, Index Ventures",2017,274590000,10,1,11,29,2021,4
630,RIDI,1.33,2022-02-28 00:00:00,South Korea,Seoul,E-commerce & direct-to-consumer,"Atinum Investment, Company K Partners, GIC",2008,331230000,14,5,2,28,2022,14
631,Flipboard,1.32,2015-07-22 00:00:00,United States,Palo Alto,Internet software & services,"Kleiner Perkins Caufield & Byers, Comcast Ventures, Insight Partners",2010,210500000,19,5,7,22,2015,5
632,Grove Collaborative,1.32,2019-09-06 00:00:00,United States,San Francisco,E-commerce & direct-to-consumer,"MHS Capital, NextView Ventures, Mayfield Fund",2016,453010000,21,5,9,6,2019,3
633,GPclub,1.32,2018-10-22 00:00:00,South Korea,Seoul,Other,Goldman Sachs,2003,66160000,1,1,10,22,2018,15
634,Tongdun Technology,1.32,2019-04-25 00:00:00,China,Hangzhou,Cybersecurity,"Advantech Capital, Temasek Holdings Ltd., Tiantu Capital Co.",2013,361440000,17,5,4,25,2019,6
635,Athletic Greens,1.32,2022-01-25 00:00:00,United States,New York,Health,"SC.Holdings, Not Boring Capital, Bolt Ventures",2010,115000000,33,1,1,25,2022,12
636,Unisound,1.31,2018-07-19 00:00:00,China,Beijing,Artificial Intelligence,"Qiming Venture Partners, China Internet Investment Fund, Qualcomm Ventures",2012,339110000,15,3,7,19,2018,6
637,Alzheon,1.31,2020-09-30 00:00:00,United States,Framingham,Health,"ARCH Venture Partners, Ally Bridge Group",2013,94400000,4,2,9,30,2020,7
638,HeartFlow,1.3,2017-12-04 00:00:00,United States,Redwood City,Health,"BlueCross BlueShield Venture Partners, US Venture Partners",2007,542410000,12,9,12,4,2017,10
641,InSightec,1.3,2020-03-06 00:00:00,Israel,Tirat Carmel,Health,"York Capital Management, GE Healthcare, Koch Disruptive Technologies",1999,559050000,11,3,3,6,2020,21
642,Everly Health,1.3,2020-12-03 00:00:00,United States,Austin,E-commerce & direct-to-consumer,"Highland Capital Partners, Next Coast Ventures, SoGal Ventures",2015,230550000,18,3,12,3,2020,5
643,Manner,1.3,2020-12-24 00:00:00,China,Shanghai,Other,"Coatue Management, H Capital, Capital Today",2015,11540000,6,2,12,24,2020,5
644,TalkingData,1.3,2021-01-06 00:00:00,China,Beijing,Mobile & telecommunications,"N5 Capital, CR Capital Mgmt, JD Digits",2013,310000000,7,1,1,6,2021,8
646,Konfio,1.3,2021-09-29 00:00:00,Mexico,Mexico City,Fintech,"Kaszek Ventures, QED Investors, International Finance Corporation",2013,824590000,16,3,9,29,2021,8
647,Betterment,1.3,2021-09-29 00:00:00,United States,New York,Fintech,"Bessemer Venture Partners, Menlo Ventures, Anthermis",2010,435000000,20,7,9,29,2021,11
648,Flock Freight,1.3,2021-10-20 00:00:00,United States,Encinitas,"Supply chain, logistics, & delivery","SignalFire, GLP Capital Partners, Google Ventures",2015,399700000,9,2,10,20,2021,6
649,YugaByte,1.3,2021-10-28 00:00:00,United States,Sunnyvale,Data management & analytics,"Lightspeed Venture Partners, Dell Technologies Capital, Wipro Ventures",2016,290000000,10,3,10,28,2021,5
650,Lukka,1.3,2022-01-14 00:00:00,United States,New York,Fintech,"Liberty City Ventures, Soros Fund Management, Summer Capital",2014,207300000,13,4,1,14,2022,8
651,TravelPerk,1.3,2022-01-12 00:00:00,Spain,Barcelona,Travel,"LocalGlobe, Kinnevik, Felix Capital",2015,408580000,15,3,1,12,2022,7
652,iTrustCapital,1.3,2022-01-11 00:00:00,United States,Long Beach,Fintech,"Left Lane Capital, Walden Venture Capital",2018,125000000,2,1,1,11,2022,4
653,Domestika,1.3,2022-01-27 00:00:00,United States,Berkeley,Internet software & services,"Zeev Ventures, GSV Ventures",2012,200000000,2,2,1,27,2022,10
654,CoinTracker,1.3,2022-01-27 00:00:00,United States,San Francisco,Fintech,"Initialized Capital, General Catalyst, Kraken Ventures",2017,101620000,17,1,1,27,2022,5
655,Loadsmart,1.3,2022-02-01 00:00:00,United States,New York,"Supply chain, logistics, & delivery","Chromo Invest, Maersk Growth, BlackRock",2014,345200000,10,2,2,1,2022,8
656,TUNGEE,1.3,2021-12-15 00:00:00,China,Guangzhou,Artificial Intelligence,"UNITY VENTURES, Qiming Venture Partners, GGV Capital",2016,171050000,9,1,12,15,2021,5
657,Starry,1.29,2018-07-03 00:00:00,United States,Boston,Mobile & telecommunications,"Social Capital, Bessemer Venture Partners",2014,163000000,7,4,7,3,2018,4
658,Intercom,1.28,2018-03-27 00:00:00,United States,San Francisco,Internet software & services,"FirstMark Capital, Tiger Global Management",2011,240250000,20,5,3,27,2018,7
659,OVO Energy,1.28,2019-02-14 00:00:00,United Kingdom,Bristol,Other,"Mitsubishi Corporation, Mayfair Equity Partners",2009,256000000,2,2,2,14,2019,10
660,Huisuanzhang,1.28,2021-05-24 00:00:00,China,Beijing,Fintech,"IDG Capital, Gaocheng Capital, Chuanrong Capital",2015,227340000,15,3,5,24,2021,6
662,BigID,1.25,2020-12-16 00:00:00,United States,New York,Cybersecurity,"BOLDstart Ventures, SAP.iO Fund, Scale Venture Partners",2015,246100000,19,4,12,16,2020,5
663,Kuaikan Manhua,1.25,2017-12-01 00:00:00,China,Beijing,Internet software & services,"Sequoia Capital China, CMC Capital Partners, Tencent Holdings",2014,595000000,14,3,12,1,2017,3
664,Marshmallow,1.25,2021-09-08 00:00:00,United Kingdom,London,Fintech,"Passion Capital, Hedosophia, 	Outrun Ventures",2017,116200000,6,2,9,8,2021,4
665,Honor Technology,1.25,2021-10-05 00:00:00,United States,San Francisco,Internet software & services,"Andreessen Horowitz, Prosus Ventures, Thrive Capital",2014,622120000,53,4,10,5,2021,7
