,Company,Valuation ($B),Date Joined,Country,City,Industry,Select Inverstors,Founded Year,Total Raised,Investors Count,Deal Terms,Date,Month,Year,Years Taken to become Unicorn
0,Bytedance,140,2017-04-07 00:00:00,China,Beijing,Artificial Intelligence,"Sequoia Capital China, SIG Asia Investments, Sina Weibo, Softbank Group",2012,7440000000,28,8,4,7,2017,5
1,SpaceX,100.3,2012-12-01 00:00:00,United States,Hawthorne,Other,"Founders Fund, Draper Fisher Jurvetson, Rothenberg Ventures",2002,6874000000,29,12,12,1,2012,10
2,Stripe,95,2014-01-23 00:00:00,United States,San Francisco,Fintech,"Khosla Ventures, LowercaseCapital, capitalG",2010,2901000000,39,12,1,23,2014,4
3,Klarna,45.6,2011-12-12 00:00:00,Sweden,Stockholm,Fintech,"Institutional Venture Partners, Sequoia Capital, General Atlantic",2005,3472000000,56,13,12,12,2011,6
4,Epic Games,42,2018-10-26 00:00:00,United States,Cary,Other,"Tencent Holdings, KKR, Smash Ventures",1991,4377000000,25,5,10,26,2018,27
5,Canva,40,2018-01-08 00:00:00,Australia,Surry Hills,Internet software & services,"Sequoia Capital China, Blackbird Ventures, Matrix Partners",2012,571260000,26,8,1,8,2018,6
6,Checkout.com,40,2019-05-02 00:00:00,United Kingdom,London,Fintech,"Tiger Global Management, Insight Partners, DST Global",2012,1830000000,15,4,5,2,2019,7
7,Instacart,39,2014-12-30 00:00:00,United States,San Francisco,"Supply chain, logistics, & delivery","Khosla Ventures, Kleiner Perkins Caufield & Byers, Collaborative Fund",2012,2686000000,29,12,12,30,2014,2
8,Databricks,38,2019-02-05 00:00:00,United States,San Francisco,Data management & analytics,"Andreessen Horowitz, New Enterprise Associates, Battery Ventures",2013,3497000000,29,8,2,5,2019,6
9,Revolut,33,2018-04-26 00:00:00,United Kingdom,London,Fintech,"index Ventures, DST Global, Ribbit Capital",2015,1716000000,31,6,4,26,2018,3
11,Fanatics,27,2012-06-06 00:00:00,United States,Jacksonville,E-commerce & direct-to-consumer,"SoftBank Group, Andreessen Horowitz, Temasek Holdings",1995,4190000000,21,10,6,6,2012,17
12,Chime,25,2019-03-05 00:00:00,United States,San Francisco,Fintech,"Forerunner Ventures, Crosslink Capital, Homebrew",2013,2599000000,24,9,3,5,2019,6
13,BYJU's,21,2017-07-25 00:00:00,India,Bengaluru,Edtech,"Tencent Holdings, Lightspeed India Partners, Sequoia Capital India",2008,5183000000,45,19,7,25,2017,9
14,Xiaohongshu,20,2016-03-31 00:00:00,China,Shanghai,E-commerce & direct-to-consumer,"GGV Capital, ZhenFund, Tencent",2013,917500000,9,3,3,31,2016,3
15,J&T Express,20,2021-04-07 00:00:00,Indonesia,Jakarta,"Supply chain, logistics, & delivery","Hillhouse Capital Management, Boyu Capital, Sequoia Capital China",2015,4653000000,9,3,4,7,2021,6
16,Miro,17.5,2022-01-05 00:00:00,United States,San Francisco,Internet software & services,"Accel, AltaIR Capital, Technology Crossover Ventures",2011,475000000,18,1,1,5,2022,11
17,Yuanfudao,15.5,2017-05-31 00:00:00,China,Beijing,Edtech,"Tencent Holdings, Warbug Pincus, IDG Capital",2012,4044000000,18,7,5,31,2017,5
18,DJI Innovations,15,2015-01-23 00:00:00,China,Shenzhen,Hardware,"Accel Partners, Sequoia Capital",2006,1135000000,7,3,1,23,2015,9
19,SHEIN,15,2018-07-03 00:00:00,China,Shenzhen,E-commerce & direct-to-consumer,"Tiger Global Management, Sequoia Capital China, Shunwei Capital Partners",2008,553360000,8,3,7,3,2018,10
20,goPuff,15,2020-10-08 00:00:00,United States,Philadelphia,E-commerce & direct-to-consumer,"Accel, Softbank Group, Anthos Capital",2013,3397000000,16,4,10,8,2020,7
21,Yuanqi Senlin,15,2020-03-01 00:00:00,China,Beijing,Consumer & retail,"Sequoia Capital China, Longfor Capitalm, Gaorong Capital",2016,721310000,13,3,3,1,2020,4
22,Ripple,15,2019-12-20 00:00:00,United States,San Francisco,Fintech,"IDG Capital, Venture51, Lightspeed Venture Partners",2012,293900000,34,5,12,20,2019,7
23,Plaid,13.4,2018-12-11 00:00:00,United States,San Francisco,Fintech,"New Enterprise Associates, Spar Capital, Index Ventures",2012,734800000,24,5,12,11,2018,6
24,OpenSea,13.3,2021-07-20 00:00:00,United States,New York,E-commerce & direct-to-consumer,"Andreessen Horowitz, Thirty Five Ventures, Sound Ventures",2017,425120000,26,2,7,20,2021,4
25,Grammarly,13,2019-10-10 00:00:00,United States,San Francisco,Internet software & services,"General Catalyst, Institutional Venture Partners, Breyer Capital",2009,400000000,8,3,10,10,2019,10
26,Devoted Health,12.6,2018-10-16 00:00:00,United States,Waltham,Health,"Andreessen Horowitz, F-Prime Capital, Venrock",2017,1969000000,16,4,10,16,2018,1
27,Faire,12.4,2019-10-30 00:00:00,United States,San Francisco,Artificial Intelligence,"Khosla Ventures, Forerunner Ventures, Sequoia Capital",2017,1096000000,14,6,10,30,2019,2
28,Brex,12.3,2018-10-05 00:00:00,United States,San Francisco,Fintech,"DST Global, Ribbit Capital, Greenoaks Capital Management",2017,1490000000,28,7,10,5,2018,1
29,JUUL Labs,12,2017-12-20 00:00:00,United States,San Francisco,Consumer & retail,Tiger Global Management,2015,1490000000,28,7,12,20,2017,2
30,Bitmain Technologies,12,2018-07-06 00:00:00,China,Beijing,Hardware,"Coatue Management, Sequoia Capital China, IDG Capital",2015,1490000000,28,7,7,6,2018,3
31,Biosplice Therapeutics,12,2018-08-06 00:00:00,United States,San Diego,Health,"Vickers Venture Partners, IKEA GreenTech",2008,561500000,10,1,8,6,2018,10
32,GoodLeap,12,2021-10-13 00:00:00,United States,Roseville,Internet software & services,"New Enterprise Associates, BDT Capital Partners, Davidson Kempner Capital Management",2003,1800000000,8,1,10,13,2021,18
33,Airtable,11.7,2018-11-15 00:00:00,United States,San Francisco,Internet software & services,"Caffeinated Capital, CRV, Founder Collective",2013,1353000000,41,6,11,15,2018,5
34,ZongMu Technology,11.4,2021-06-03 00:00:00,China,Shanghai,Auto & transportation,"LTW Capital, Legend Capital, Qualcomm Ventures",2013,210830000,19,2,6,3,2021,8
35,Global Switch,11.1,2016-12-22 00:00:00,United Kingdom,London,Hardware,"Aviation Industry Corporation of China, Essence Financial, Jiangsu Sha Steel Group",1998,6255000000,6,2,12,22,2016,18
36,Celonis,11,2018-06-26 00:00:00,Germany,Munich,Data management & analytics,"Accel, 83North",2011,1368000000,13,4,6,26,2018,7
37,Bolt,11,2021-10-08 00:00:00,United States,San Francisco,Fintech,"Activant Capital, Tribe Capital, General Atlantic",2014,963000000,37,3,10,8,2021,7
38,Alchemy,10.2,2021-10-28 00:00:00,United States,San Francisco,Fintech,"DFJ Growth Fund, Coatue Management, Addition",2017,545000000,27,3,10,28,2021,4
40,Swiggy,10.7,2018-06-21 00:00:00,India,Bengaluru,"Supply chain, logistics, & delivery","Accel India, SAIF Partners, Norwest Venture Partners",2014,3571000000,36,12,6,21,2018,4
41,Lalamove,10,2019-02-21 00:00:00,Hong Kong,Cheung Sha Wan,"Supply chain, logistics, & delivery","MindWorks Ventures, Shunwei Capital Partners, Xiang He Capital",2013,2475000000,15,5,2,21,2019,6
42,Figma,10,2020-04-30 00:00:00,United States,San Francisco,Internet software & services,"Index Ventures, Greylock Partners, Kleiner Perkins Caufield & Byers",2012,333500000,20,6,4,30,2020,8
43,Gusto,10,2015-12-18 00:00:00,United States,San Francisco,Fintech,"General Catalyst Partners, Google Ventures, Kleiner Perkins Caufield & Byers",2011,691120000,70,9,12,18,2015,4
44,reddit,10,2017-07-31 00:00:00,United States,San Francisco,Internet software & services,"Y Combinator, Sequoia Capital, Coatue Management",2005,1326000000,33,5,7,31,2017,12
45,Talkdesk,10,2018-10-03 00:00:00,United States,San Francisco,Internet software & services,"DJF, Salesforce Ventures, Storm Ventures",2011,504770000,19,6,10,3,2018,7
46,Notion Labs,10,2020-04-01 00:00:00,United States,San Francisco,Internet software & services,"Index Ventures, Draft Ventures, Felicis Ventures",2016,342000000,17,3,4,1,2020,4
47,Thrasio,10,2020-07-15 00:00:00,United States,Walpole,Other,"Upper90, RiverPark Ventures, Advent International",2018,3396000000,22,5,7,15,2020,2
48,Digital Currency Group,10,2021-11-01 00:00:00,United States,New York,Fintech,"Ribbit Capital, capitalG, Softbank Group",2018,3396000000,22,5,11,1,2021,3
49,OutSystems,9.5,2018-06-05 00:00:00,United States,Boston,Internet software & services,"KKR, ES Ventures, North Bridge Growth Equity",2001,572010000,13,3,6,5,2018,17
50,ServiceTitan,9.5,2018-11-14 00:00:00,United States,Glendale,Internet software & services,"Bessemer Venture Partners, ICONIQ Capital, Battery Ventures",2012,1099000000,16,6,11,14,2018,6
51,HEYTEA,9.28,2019-07-01 00:00:00,China,Shenzhen,Other,"Sequoia Capital China, Tencent Investment, BA Capital",2012,579230000,13,3,7,1,2019,7
52,N26,9.23,2019-01-10 00:00:00,Germany,Berlin,Fintech,"Redalpine Venture Partners, Earlybird Venture Capital, Valar Ventures",2013,1722000000,21,7,1,10,2019,6
53,Klaviyo,9.2,2020-11-17 00:00:00,United States,Boston,Internet software & services,"Summit Partners, Accel, Astral Capital",2012,678500000,15,3,11,17,2020,8
54,Northvolt,9.08,2019-06-12 00:00:00,Sweden,Stockholm,Other,"Vattenfall, Volkswagen Group, Goldman Sachs",2016,6162000000,54,4,6,12,2019,3
55,Tanium,9,2015-03-31 00:00:00,United States,Kirkland,Cybersecurity,"Andreessen Horowitz, Nor-Cal Invest, TPG Growth",2007,1170000000,15,13,3,31,2015,8
56,Chehaoduo,9,2016-03-12 00:00:00,China,Beijing,E-commerce & direct-to-consumer,"Sequoia Capital China, GX Capital",2015,4304000000,35,4,3,12,2016,1
57,Niantic,9,2017-11-24 00:00:00,United States,San Francisco,Mobile & telecommunications,"Nintendo, Google, Pokemon Company International, Spark Capital",2015,770000000,22,5,11,24,2017,2
58,OYO Rooms,9.6,2018-09-25 00:00:00,India,Gurugram,Travel,"SoftBank Group, Sequoia Capital India,Lightspeed India Partners",2012,3114000000,20,11,9,25,2018,6
59,Rapyd,8.75,2019-12-03 00:00:00,United Kingdom,London,Fintech,"Target Global, General Catalyst, Durable Capital Partners",2016,775000000,21,4,12,3,2019,3
60,Kavak,8.7,2020-10-01 00:00:00,Mexico,Lerma de Villada,E-commerce & direct-to-consumer,"DST Global, SoftBank Group, Mountain Nazca",2016,1188000000,16,4,10,1,2020,4
61,Snyk,8.6,2020-01-21 00:00:00,United States,Boston,Cybersecurity,"BOLDstart Ventures, Google Ventures, Accel",2015,1026000000,26,9,1,21,2020,5
62,Nuro,8.6,2019-02-11 00:00:00,United States,Mountain View,Auto & transportation,"SoftBank Group, Greylock Partners, Gaorong Capital",2016,2132000000,11,4,2,11,2019,3
63,Bolt,8.4,2018-05-29 00:00:00,Estonia,Tallinn,Auto & transportation,"Didi Chuxing, Diamler, TMT Investments",2013,1971000000,28,5,5,29,2018,5
64,Lacework,8.3,2021-01-07 00:00:00,United States,San Jose,Cybersecurity,"Sutter Hill Ventures, Liberty Global Ventures, Coatue Management",2015,1907000000,19,4,1,7,2021,6
65,Tipalti,8.3,2020-10-06 00:00:00,United States,San Mateo,Fintech,"01 Advisors, Zeev Ventures, Group 11",2010,556000000,10,5,10,6,2020,10
66,Tempus,8.1,2018-03-21 00:00:00,United States,Chicago,Health,"New Enterprise Associates, T. Rowe Associates, Lightbank",2015,1070000000,10,6,3,21,2018,3
67,Xingsheng Selected,8,2020-07-22 00:00:00,China,Changsha,E-commerce & direct-to-consumer,"KKR, Tencent Holdings, Sequoia Capital China",2009,5040000000,14,5,7,22,2020,11
68,Dream11,8,2019-04-09 00:00:00,India,Mumbai,Internet software & services,"Kaalari Capital, Tencent Holdings, Steadview Capital",2007,1165000000,15,8,4,9,2019,12
69,Fireblocks,8,2021-07-27 00:00:00,United States,New York,Fintech,"Tenaya Capital, Coatue Management, Stripes Group",2018,1039000000,27,3,7,27,2021,3
70,Ramp,8,2021-03-29 00:00:00,United States,New York,Fintech,"D1 Capital Partners, Stripe, Coatue Management",2019,827000000,18,5,3,29,2021,2
71,Flexport,8,2018-04-30 00:00:00,United States,San Francisco,"Supply chain, logistics, & delivery","Bloomberg Beta, Founders Fund, First Round Capital",2013,2237000000,28,6,4,30,2018,5
72,Caris Life Sciences,7.83,2021-05-17 00:00:00,United States,Irving,Health,"Sixth Street Partners, OrbiMed Advisors, Highland Capital Management",1996,1314000000,17,3,5,17,2021,25
73,Dapper Labs,7.6,2021-03-30 00:00:00,Canada,Vancouver,Fintech,"Union Square Ventures, Venrock, Andreessen Horowitz",2018,671900000,85,3,3,30,2021,3
75,Getir,7.5,2021-03-26 00:00:00,Turkey,Istanbul,E-commerce & direct-to-consumer,"Tiger Global Management, Sequoia Capital, Revo Capital",2015,1172000000,15,3,3,26,2021,6
76,Netskope,7.5,2018-11-13 00:00:00,United States,Santa Clara,Cybersecurity,"Lightspeed Venture Partners, Social Capital, Accel",2012,1040000000,13,8,11,13,2018,6
77,Razorpay,7.5,2020-10-11 00:00:00,India,Bengaluru,Fintech,"Sequoia Capital India, Tiger Global Management, Matrix Partners India",2013,741620000,24,6,10,11,2020,7
78,Toss,7.4,2018-12-09 00:00:00,South Korea,Seoul,Fintech,"Bessemer Venture Partners, Qualcomm Ventures, Kleiner Perkins Caufield & Byers",2013,844200000,17,6,12,9,2018,5
79,Carta,7.4,2019-05-06 00:00:00,United States,San Francisco,Fintech,"Menlo Ventures, Spark Capital, Union Square Ventures",2012,1158000000,32,8,5,6,2019,7
82,Gong,7.25,2020-08-12 00:00:00,United States,Palo Alto,Artificial Intelligence,"Norwest Venture Partners, Next World Capital, Wing Venture Capital",2015,583000000,13,4,8,12,2020,5
83,TripActions,7.25,2018-11-08 00:00:00,United States,Palo Alto,Travel,"Andreessen Horowitz, Lightspeed Venture Partners, Zeev Ventures",2015,1040000000,13,6,11,8,2018,3
84,Gemini,7.1,2021-11-19 00:00:00,United States,New York,Fintech,"Morgan Creek Digital, Marcy Venture Partners, 10T Fund",2015,400000000,15,1,11,19,2021,6
85,We Doctor,7,2015-09-22 00:00:00,China,Hangzhou,Health,"Tencent, Morningside Group",2010,1786000000,16,3,9,22,2015,5
86,Discord,7,2018-04-20 00:00:00,United States,San Francisco,Internet software & services,"Benchmark, Greylock Partners, Tencent Holdings",2012,979300000,28,10,4,20,2018,6
87,Ro,7,2020-07-27 00:00:00,United States,New York,Health,"Initialized Capital, General Catalyst, SignalFire",2017,1027000000,27,5,7,27,2020,3
88,Automation Anywhere,6.8,2018-07-02 00:00:00,United States,San Jose,Artificial Intelligence,"General Atlantic, Goldman Sachs, New Enterprise Associates",2003,840000000,8,3,7,2,2018,15
89,1Password,6.8,2021-07-08 00:00:00,Canada,Toronto,Cybersecurity,"Slack Fund, Accel, Skip Capital",2005,920140000,30,2,7,8,2021,16
90,Ziroom,6.6,2018-01-17 00:00:00,China,Beijing,E-commerce & direct-to-consumer,"Sequoia Capital China, Warburg Pincus, General Catalyst",2011,2121000000,12,3,1,17,2018,7
91,National Stock Exchange of India,6.5,2020-07-01 00:00:00,India,Mumbai,Fintech,"TA Associates, SoftBank Group, GS Growth",1992,149500000,7,1,7,1,2020,28
92,Mollie,6.5,2020-09-08 00:00:00,Netherlands,Amsterdam,Fintech,Technology Crossover Ventures,2004,934320000,12,2,9,8,2020,16
93,Rippling,6.5,2020-08-04 00:00:00,United States,San Francisco,Internet software & services,"Initialized Capital, Y Combinator, Kleiner Perkins Caufield & Byers",2017,447120000,15,4,8,4,2020,3
95,DataRobot,6.3,2019-07-29 00:00:00,United States,Boston,Artificial Intelligence,"New Enterprise Associates, Accomplice, IA Ventures",2012,1089000000,36,7,7,29,2019,7
96,Personio,6.3,2021-01-19 00:00:00,Germany,Munich,Internet software & services,"Global Founders Capital, Nortzone Ventures, Picus Capital",2015,524830000,17,4,1,19,2021,6
97,Upgrade,6.28,2018-02-12 00:00:00,United States,San Francisco,Fintech,"Union Square Ventures, Ribbit Capital, VY Capital",2016,562500000,23,5,2,12,2018,2
98,Hinge Health,6.2,2021-01-06 00:00:00,United States,San Francisco,Health,"Atomico, Insight Partners, Coatue Management",2015,853850000,13,6,1,6,2021,6
99,Black Unicorn Factory,6.1,2021-05-20 00:00:00,United States,Los Angeles,Other,Barter Ventures,2020,645000000,1,1,5,20,2021,1
100,Benchling,6.1,2021-04-14 00:00:00,United States,San Francisco,Internet software & services,"Thrive Capital, Benchmark, MenloVentures",2012,412000000,29,5,4,14,2021,9
101,Royole Corporation,6,2015-08-18 00:00:00,China,Shenzhen,Hardware,"Warmsun Holding, IDG Capital Partners",2012,1414000000,32,4,8,18,2015,3
102,Better.com,6,2020-11-10 00:00:00,United States,New York,Fintech,"Pine Brook, American Express Ventures, Kleiner Perkins Caufield & Byers",2018,1420000,2,,11,10,2020,2
103,Wiz,6,2021-03-17 00:00:00,Israel,Tel Aviv,Cybersecurity,"Insight Partners, Sequoia Capital, Index Ventures",2020,600000000,10,4,3,17,2021,1
104,iCapital Network,6,2021-07-27 00:00:00,United States,New York,Fintech,"BlackRock, Blackstone, UBS",2013,729220000,28,2,7,27,2021,8
105,Pine Labs,6,2020-01-24 00:00:00,India,Noida,Fintech,"Sequoia Capital India, Temasek, PayPal Ventures",1998,1077000000,25,6,1,24,2020,22
106,6Sense,5.2,2021-03-30 00:00:00,United States,San Francisco,Artificial Intelligence,"Venrock, Battery Ventures, Insight Partners",2013,424000000,19,6,3,30,2021,8
107,Attentive,5.99,2020-09-23 00:00:00,United States,Hoboken,Mobile & telecommunications,"NextView Ventures, Eniac Ventures, Sequoia Capital",2016,864520000,12,2,9,23,2020,4
108,Easyhome,5.78,2018-02-12 00:00:00,China,Beijing,Consumer & retail,"Alibaba Group, Boyu Capital, Borui Capital",1999,2085000000,12,1,2,12,2018,19
109,Lianjia,5.77,2016-04-07 00:00:00,China,Beijing,E-commerce & direct-to-consumer,"Tencent, Baidu, Huasheng Capital",2001,1701000000,15,2,4,7,2016,15
110,Vice Media,5.7,2011-04-02 00:00:00,United States,Brooklyn,Internet software & services,"Technology Crossover Ventures, A&E Television Networks",1994,1555000000,14,6,4,2,2011,17
111,Cityblock Health,5.7,2020-12-10 00:00:00,United States,Brooklyn,Health,"Thrive Capital, Maverick Ventures, Redpoint Ventures",2017,891300000,17,3,12,10,2020,3
112,Workato,5.7,2021-01-12 00:00:00,United States,Mountain View,Internet software & services,"Battery Ventures, Storm Ventures, Redpoint Ventures",2013,415000000,11,3,1,12,2021,8
113,Back Market,5.7,2021-05-18 00:00:00,France,Paris,E-commerce & direct-to-consumer,"Aglae Ventures, Eurazeo, Daphni",2014,1021000000,12,4,5,18,2021,7
114,RELEX Solutions,5.7,2022-02-17 00:00:00,Finland,Helsinki,"Supply chain, logistics, & delivery","Blackstone, Technology Crossover Ventures, Summit Partners",2005,792360000,4,1,2,17,2022,17
115,Postman,5.6,2020-06-11 00:00:00,United States,San Francisco,Internet software & services,"Nexus Venture Partners, CRV, Insight Partners",2014,433000000,8,3,6,11,2020,6
116,FiveTran,5.6,2020-06-30 00:00:00,United States,Oakland,Data management & analytics,"Matrix Partners, Andreessen Horowitz, General Catalyst",2012,728020000,8,3,6,30,2020,8
117,Pony.ai,5.3,2018-07-11 00:00:00,United States,Fremont,Artificial Intelligence,"Sequoia Capital China, IDG Capital, DCM Ventures",2016,1093000000,25,7,7,11,2018,2
118,Trade Republic,5.3,2021-05-20 00:00:00,Germany,Berlin,Fintech,"Founders Fund. Accel, Creandum",2015,986880000,7,1,5,20,2021,6
119,Rappi,5.25,2018-08-31 00:00:00,Colombia,Bogota,"Supply chain, logistics, & delivery","DST Global, Andreessen Horowitz, Sequoia Capital, Redpoint e.ventures",2015,2248000000,35,5,8,31,2018,3
120,Collibra,5.25,2019-01-29 00:00:00,Belgium,Brussels,Data management & analytics,"Index Ventures, Battery Ventures, ICONIQ Capital",2008,595900000,13,6,1,29,2019,11
121,Blockchain.com,5.2,2021-02-17 00:00:00,United Kingdom,London,Fintech,"Lightspeed Venture Partners, Google Ventures, Lakestar",2011,490500000,22,4,2,17,2021,10
122,OneTrust,5.1,2019-07-11 00:00:00,United States,Atlanta,Internet software & services,Insight Partners,2016,937290000,5,3,7,11,2019,3
123,QuintoAndar,5.1,2019-09-09 00:00:00,Brazil,Campinas,E-commerce & direct-to-consumer,"Kaszek Ventures, General Atlantic, SoftBank Group",2012,755740000,16,6,9,9,2019,7
125,United Imaging Healthcare,5,2017-09-15 00:00:00,China,Shanghai,Health,"China Life Insurance, China Development Bank Capital, CITIC Securities International",2011,500000000,6,1,9,15,2017,6
126,Hello TransTech,5,2018-06-01 00:00:00,China,Shanghai,Auto & transportation,"Ant Financial Services Group, GGV Capital",2016,2701000000,13,3,6,1,2018,2
127,Deel,5.5,2021-04-21 00:00:00,United States,San Francisco,Fintech,"Andreessen Horowitz, Spark Capital, Y Combinator",2018,625150000,19,3,4,21,2021,3
128,Airwallex,5.5,2019-03-25 00:00:00,Australia,Melbourne,Fintech,"DST Global, Sequoia Capital China, Tencent Holdings",2015,802000000,23,8,3,25,2019,4
129,Mambu,5.5,2021-01-06 00:00:00,Netherlands,Amsterdam,Fintech,"Runa Capital, Acton Capital Partners, Point Nine Capital",2011,445510000,10,4,1,6,2021,10
130,Horizon Robotics,5,2019-02-27 00:00:00,China,Beijing,Artificial Intelligence,"Hillhouse Capital Management, Linear Venture, Morningside Venture Capital",2015,2200000000,56,2,2,27,2019,4
131,WM Motor,5,2019-03-08 00:00:00,China,Shanghai,Auto & transportation,"Baidu Capital, Linear Venture, Tencent",2015,5987000000,35,1,3,8,2019,4
132,Howden Group Holdings,5,2020-09-29 00:00:00,United Kingdom,London,Other,"General Atlantic, 3i Group, Huagai Capital",1994,187260000,4,3,9,29,2020,26
133,SambaNova Systems,5,2021-04-13 00:00:00,United States,Palo Alto,Data management & analytics,"Walden International, Google Ventures, Intel Capital",2017,1132000000,10,2,4,13,2021,4
134,ZEPZ,5,2021-08-23 00:00:00,United Kingdom,London,Fintech,"Accel, Technology Crossover Ventures, LeapFrog Investments",2010,692000000,9,6,8,23,2021,11
135,OakNorth Bank,5,2017-10-12 00:00:00,United Kingdom,London,Fintech,"Clermont Group, Coltrane Asset Management, Toscafund Asset Management",2015,990520000,10,6,10,12,2017,2
136,Moon Active,5,2020-01-26 00:00:00,Israel,Tel Aviv,Mobile & telecommunications,"Insight Partners, Andalusian Capital Partners",2015,990520000,10,6,1,26,2020,5
137,OfBusiness,5,2021-07-31 00:00:00,India,Gurgaon,E-commerce & direct-to-consumer,"Matrix Partners India, Falcon Edge Capital, SoftBank Group",2015,855550000,14,6,7,31,2021,6
138,Cockroach Labs,5,2021-01-12 00:00:00,United States,New York,Data management & analytics,"Google Ventures, Benchmark, FirstMark Capital",2015,632850000,17,5,1,12,2021,6
139,Qonto,5,2022-01-11 00:00:00,France,Paris,Fintech,"Alven Capital, Valar Ventures, Tencent Holdings",2016,703390000,17,3,1,11,2022,6
140,Ola Electric Mobility,5,2019-07-02 00:00:00,India,Bengaluru,Auto & transportation,"SoftBank Group, Tiger Global Management, Matrix Partners India",2019,822290000,20,3,7,2,2019,0
141,Icertis,5,2019-07-17 00:00:00,United States,Bellevue,Artificial Intelligence,"Eight Roads Ventures, Greycroft, Ignition Partners",2009,371500000,12,6,7,17,2019,10
142,Hopper,5,2021-03-24 00:00:00,Canada,Montreal,Travel,"Capital One Growth Ventures, Citi Ventures, OMERS Ventures",2007,614200000,18,6,3,24,2021,14
143,Meesho,4.9,2021-04-05 00:00:00,India,Bengaluru,Internet software & services,"Venture Highway, Sequoia Capital India, Prosus Ventures",2015,1061000000,26,5,4,5,2021,6
145,Creditas,4.8,2020-12-18 00:00:00,Brazil,Sao Paulo,Fintech,"Kaszek Ventures, Amadeus Capital Partners, Quona Capital",2012,867440000,25,5,12,18,2020,8
147,Pleo,4.7,2021-07-06 00:00:00,Denmark,Copenhagen,Fintech,"Creandum, Founders, Kinnevik",2015,428800000,16,4,7,6,2021,6
148,Anduril,4.6,2019-09-11 00:00:00,United States,Irvine,Artificial Intelligence,"Andreessen Horowitz, Founders Fund, Revolution Ventures",2017,828500000,14,4,9,11,2019,2
149,Lyra Health,5.85,2020-08-25 00:00:00,United States,Burlingame,Health,"Greylock Partners, Venrock, Providence Ventures",2015,906130000,22,7,8,25,2020,5
150,Dataiku,4.6,2019-12-04 00:00:00,United States,New York,Internet software & services,"Alven Capital, FirstMark Capital, capitalG",2013,646600000,16,5,12,4,2019,6
151,Checkr,4.6,2019-09-19 00:00:00,United States,San Francisco,Internet software & services,"Y Combinator, Accel, T. Rowe Price",2014,559000000,24,5,9,19,2019,5
152,Color,4.6,2021-01-04 00:00:00,United States,Burlingame,Health,"General Catalyst, Viking Global Investors, T. Rowe Price",2013,496040000,25,5,1,4,2021,8
153,Meizu Technology,4.58,2014-07-23 00:00:00,China,Zhuhai,Hardware,"Telling Telecommunication Holding Co., Alibaba Group",2003,943100000,4,2,7,23,2014,11
154,Vinted,4.53,2019-11-27 00:00:00,Lithuania,Vilnius,E-commerce & direct-to-consumer,"Accel, Insight Partners, Burda Principal Investments",2008,562230000,9,5,11,27,2019,11
155,VIPKid,4.5,2016-08-04 00:00:00,China,Beijing,Edtech,"Sequoia Capital China, Tencent Holdings, Sinovation Ventures",2013,975490000,12,3,8,4,2016,3
156,Socure,4.5,2021-03-16 00:00:00,United States,New York,Cybersecurity,"Two Sigma Ventures, Flint Capital, Commerce Ventures",2012,648250000,22,4,3,16,2021,9
158,UBTECH Robotics,4.58,2016-07-25 00:00:00,China,Shenzhen,Hardware,"CDH Investments, Goldstone Investments, Qiming Venture Partners",2012,645600000,22,7,7,25,2016,4
159,Outreach,4.4,2019-04-16 00:00:00,United States,Seattle,Internet software & services,"Mayfield Fund, M12, Trinity Ventures",2011,489780000,27,9,4,16,2019,8
160,WeRide,4.4,2020-12-23 00:00:00,China,Guangzhou,Auto & transportation,"Atop Capital, IDInvest Partners, Qiming Venture Partners",2017,789000000,30,6,12,23,2020,3
161,BetterUp,4.7,2021-02-25 00:00:00,United States,San Francisco,Internet software & services,"Threshold Ventures, Lightspeed Venture Partners, Crosslink Capital",2013,566900000,18,4,2,25,2021,8
162,Arctic Wolf Networks,4.3,2020-10-22 00:00:00,United States,Eden Prairie,Cybersecurity,"Lightspeed Venture Partners, Redpoint Ventures, Viking Global Investors",2012,498250000,14,4,10,22,2020,8
163,Sorare,4.3,2021-09-21 00:00:00,France,Paris,E-commerce & direct-to-consumer,"Benchmark, Accel, SoftBank Group",2019,737080000,24,1,9,21,2021,2
164,Relativity Space,4.2,2020-11-23 00:00:00,United States,Inglewood,Other,"Playground Global, Bond, Tribe Capital",2016,1385000000,35,4,11,23,2020,4
165,Miaoshou Doctor,4.25,2019-06-27 00:00:00,China,Beijing,E-commerce & direct-to-consumer,"Sequoia Capital China, Qiming Venture Partners, Tencent Holdings",2015,971140000,21,4,6,27,2019,4
166,Chainalysis,4.2,2020-11-23 00:00:00,United States,New York,Fintech,"Addition, Benhcmark, Accel",2014,366720000,25,4,11,23,2020,6
